message,epi
ATTRIBUTIONEN WIRKEN SICH FOLGENDERMAßEN AUF DAS LERNEN AUS:,0
"Ergänzend kann man noch sagen, dass es günstig gewesen wäre den Schüler zu motivieren, dass er es durch Anstrengung schaffen kann",1
"Eine neue Idee zu diesem Fall ist aber auch, dass der Junge am Ende doch eher davon ausgeht, dass er es nicht schaffen wird. Zumindest lässt der Wortlaut vom letzten Satz darauf schließen. Meiner Meinung nach ist er nämlich doch davon überzeugt, dass seine Fähigkeit zu lernen rein von seiner angeborenen Begabung abhängt und, dass Anstrengung nur eine sekundäre Rolle für ihn spielt. Hieran sieht man finde ich sehr schön, dass der Schüler und seine Familie im Gegensatz zur Lehrerin den Erfolg in dem Fach anders begründen.",1
"Könnte man dann also sagen, er hat eine internale stabile Attribution (oder er und seine Eltern gehen zumindest davon aus), obwohl es genauso gut einfach eine internale variable Attribution sein könnte, weil er sich vielleicht einfach nur etwas mehr anstrengen muss?",1
"Du hast gerade geschrieben, dass eine Schwierigkeit die Einstellung der Person bzgl. Mathe ein Problem ist und auch die Bestätigung der Eltern, dass jeder in der Familie damit Probleme hat. Da stimme ich dir zu",0
In diesen hier,0
"Hi Bamberg, ja ich bin da und lese gerade den Text :)",0
"Also sind wir uns einig, dass Michael und sein Umfeld ein Reattributionstraining benötigen, damit Michael seinen Misserfolg und seinen Erfolg künftig internal variabel attribuieren kann? Ich denke, dass die Art und Weise, wie seine Lehrerin und seine Eltern seinen Misserfolg beschreiben, für Michael nicht hilfreich ist.",1
(external)dass er es schon irgendwie schafft.,1
Ja,0
Relativierungen des Arguments:,0
seine schlechten mathenoten werden als stabil dagestellt(eltern waren auch schlecht und er ist es bestimmt auch),0
es gehen mißerfolge voraus,1
"seine eltern setzten ohnehin fest, dass er keinerlei Begabung für dieses Fach haben kann",0
"Eine neue Idee zu diesem Fall ist zudem, auch eine internale variable Attribution zu fördern, also den Fokus auf den eigenen Fleiß und Einsatz. Dieser Fokus kommt weder in der Selbstattribution des Jungen, noch in der Selbst- und Fremdattribution der Eltern.",1
Attributionstheorie Zeile 52-57 steht warum eine internale stabile Attribution wie die Begabung eher schlecht ist für die Erklärung des Misserfolgs. Eine variable Attribution wie die Anstrengung aber eher positiv gesehen werden kann,1
"Außerdem ist die Person internal stabil eingestellt, weil sie ihren Erfolg auf Begabung oder in diesem Fall nicht Begabung zurückführt. Es ist eine Tatsache, die sich nicht verändern lässt.",0
 jedoch muss man dieses Risiko eingehen.,0
"Du kannst gut zusammenfassen! Das überlasse ich dir gerne! Gebe dir aber natürlich gerne noch Input! Ja, den Infotext können wir ja integreiren bzw. mittels Zeilenangaben mit angeben",0
Misserfolg,1
Belege und Begründungen:,0
"Denkst du, er denkt, er kann die Schwierigkeit beheben?",0
"Wenn alles klar ist, dann könnt ihr jetzt mit dem Lesen des Falls und danach mit eurer Diskussion beginnen. Bitte verwendet dabei nach Möglichkeit das Halbsätze-Tool. Ihr habt 30 Minuten Zeit.",0
" Er hofft auf sein Glück und läßt das neue Schuljahr auf sich zukommen, ohne irgendwelche Maßnahmen zu ergreifen.",1
"Wir glauben, dass Michael seine schlechten Leistungen aktuell internal stabil attribuiert und dass er daher nicht motiviert ist, sich anzustrengen, um bessere Leistungen zu erreichen. Wir erachten ein Reattributionstraining sowohl für ihn als auch für seine Eltern als wichtig, um Michael zu einer internal variablen Attribution zu führen, sowohl für Erfolg als auch für Misserfolg.",1
Eine neue Idee zu diesem Fall ist,0
"Aber wenn er vorher schon schlechte Noten hatte bevor seine Eltern ihm sowas erzählt haben, hat er ja evtl wirklich einfach nur kein Talent dafür",0
"Perfekt, danke!",0
 Er begründet seine schlechten mathematischen Leistungen mit Hilfe seiner,1
es gehen mißerfolge voraus,1
(um mal die ganzen fachbegriffe zu benutzen:)),0
wisst ihr weiter?,0
Michael sagt ja außerdem noch er sei gespannt auf das nächste Schuljahr. Also lässt er es einfach mal auf sich zukommen... nur ohne Anstrengung wird das halt nichts,0
"Unterstützt die Lehrerin den Schüler jedoch, könnte er Freude am Matheunterricht bekommen - die bester Voraussetzung sich mehr anzustrengen",0
"Wenn die Eltern in diesem Fall das Kind mehr motivieren und seine schlechten Leistungen nur auf Faulheit und nicht auf seine Person bezogenen Faktoren beziehen würden, könnte er auf jeden Fall bessere Leistungen erziehlen. ",0
Der Grund für seine schlechten Noten würde dann in der mangelnden Anstrengung liegen,1
"Ein wichtiges Konzept, was man dabei beachten sollte, ist Misserfolge bewusst auf variable Ursachen zurückzuführen. So könnte die Lehrerin einreden, dass es ein Zufall gewesen wäre, dass er in der neunten schwache Leistung erbrachte und in der zehnten Klasse andere variable externe Faktoren vorkommen könnten.",1
"Hoffe es sind keine Rechtschreibfehler vorhanden, musste schnell tippen :)",0
"Eine neue Idee zu diesem Fall ist aber auch, dass der Junge am Ende doch eher davon ausgeht, dass er es nicht schaffen wird. Zumindest lässt der Wortlaut vom letzten Satz darauf schließen. Meiner Meinung nach ist er nämlich doch davon überzeugt, dass seine Fähigkeit zu lernen rein von seiner angeborenen Begabung abhängt und, dass Anstrengung nur eine sekundäre Rolle für ihn spielt. Hieran sieht man finde ich sehr schön, dass der Schüler und seine Familie im Gegensatz zur Lehrerin den Erfolg in dem Fach anders begründen.",1
"Eine neue Idee zu diesem Fall ist zudem, auch eine internale variable Attribution zu fördern, also den Fokus auf den eigenen Fleiß und Einsatz. Dieser Fokus kommt weder in der Selbstattribution des Jungen, noch in der Selbst- und Fremdattribution der Eltern.",1
zusammenfassen??,0
"Am motivationsförderlichsten wäre es, ihm internal variable Attributionsmuster beizubringen",1
es gehen mißerfolge voraus,1
 (welche er nätürlich nicht dem ZUfall zuschieben darf) hat er dann auch mehr Motivation für weitere Gute NOten zu lernen,1
ihren schüler zu motivieren,0
 indem sie seine Schwäche ,1
"Du hast gerade etwas gesagt, dem ich  zustimme, und zwar dass das Denken seiner Familie nicht förderlich ist. Diese genannten Aspekte sind ausschlaggebend für die Situation. Hinzu kommt, dass der Schüler an Ende sagt, dass er hofft, dass er das nächste Schuljahr schafft. hier sind schon einige Zweifel herauszulesen, die auf diese Elemente zurückzuführen sind.",1
Belege und Begründungen:,0
"Er sollte seine Leistung also eher internal variable attribuieren, damit er sich verbessern kann.",1
Misserfolg,1
" Wir sind beide etwas verplant,hm?",0
"Darüber hinaus sollte die Lehrerin ihm auch zwischendurchChancen geben, dass er seine Leistung einbringen kann,",0
" Er hofft auf sein Glück und läßt das neue Schuljahr auf sich zukommen, ohne irgendwelche Maßnahmen zu ergreifen.",1
"Du hast gerade geschrieben, dass der Schüler die Situation nicht bewältigen kann, da er von seinem Umfeld genau dies suggeriert bekommt. Dem stimme ich teilweise zu. Hört der Schüler auf sein Umfeld, was ganz den Anschein macht, ist es fast unmöglich das nächste Schuljahr zu schaffen, da die ""Anstrengung"" keine bedachte Option ist. Aber",1
" was M. auch auf sich bezieht, da er dem Vater als Autoritätsperson glaubt",0
"Eine neue Idee zu diesem Fall ist zudem, auch eine internale variable Attribution zu fördern, also den Fokus auf den eigenen Fleiß und Einsatz. Dieser Fokus kommt weder in der Selbstattribution des Jungen, noch in der Selbst- und Fremdattribution der Eltern.",1
 schlechten Leistungen,1
Michael begründet seine Misserfolge ,1
stabil--> Eltern und ,0
Michael begründet seine Misserfolge ,1
Daraus folgt eine Selbstattribution die sich negativ auf Michael auswirkt.,0
Es geht ein Misserfolg im Mathematikunterricht voraus.Die Versetzung in die nächste Klasse ist gefährdet.,1
*auch von seinen internen Attributionen beeinflusst wird.,0
Michael führt sein Versagen in Mathematik ,1
die mutter hat falsch reagiert,0
"Eine neue Idee zu diesem Fall ist, dass er den Anschein erweckt, als würde er seine Zuversicht dem nächsten Schuljahr gegenüber allerdings mehr dem Zufall zuzuschreiben als seiner eigenen Fähigkeit und Arbeitsbereitschaft. Somit bezieht er seinen Erfolg auf eine externale und variable Attribution statt auf eine internale variable, was im Sinne der Leistungsfähigkeit kontraproduktiv ist.",1
Belege und Begründungen:,0
Belege und Begründungen:,0
"Aber es gibt immer irgendwas, was einem nicht Spass macht,",0
dann können wir es also gleich in die beiden dimensionen unterteilen.,0
"Zunächst einmal ist es klar, dass die Person im Text seinen (Lern-)erfolg external attribuiert.",0
Jawohl,0
"Danke! Ihr könnt den Chat jetzt über den ""Chat beenden""-Button schließen.",0
"Ich denke, Michael glaubt nicht, diese Schwierigkeit bewältigen zu können, da er am Ende ja selbst sagt, er habe das letzte Jahr noch gepackt, aber das nächste könnte wohl schwieriger werden.",1
1.Hypothese zum Fall:,0
Belege und Begründungen:,0
"Könnte man dann also sagen, er hat eine internale stabile Attribution (oder er und seine Eltern gehen zumindest davon aus), obwohl es genauso gut einfach eine internale variable Attribution sein könnte, weil er sich vielleicht einfach nur etwas mehr anstrengen muss?",1
"die eltern waren ja schliesslich auch keine ""leuchten"" in mathe ,und haben es ja auch gaschafft,d.h sie müssen sich selbst auch angestrengt haben",0
" und eventuell aus seinem Verhaltensmuster heraustreten, und sich und seine Umwelt aus einer neuen Perspektive wahrnehmen.",0
da er bisher nur mathemathische misserfolge verzeichen konnte ,1
 stabile,0
"Interessant is auch, wie du schon gesagt hast, wie Fremdattribution in diesem Fall von statten geht. Die Eltern attribuieren seine Probleme durch internal-stabile Faktoren, wie der Begabung. Ich würde eventuell sogar soweit gehen zu sagen, seine Eltern sehen dies als genetische Veranlagung. Die Lehrerin allerdings versucht, Michael dahin zu bewegen, dass er seine schlechte Leistung in Mathematik internal-variabel seiner Anstrengung zuschreibt. Laut 52 ist es ja günstig, Misserfolge auf variable Ursachen wie Anstrengung zurückzuführen.",1
"Die Hauptperson hat bedenken, nächstes Jahr nochmal Mathe zu bestehen, denkt also nicht, dass sich die Schwierigkeit leicht bewältigen lässt",1
internal,0
und vor allem auch nicht Pädagogisch sinnvoll?,0
"Der Vater macht Glück für seinen Abschluss verantwortlich (Selbstattribution, extern",1
"Du hast gerade geschrieben, dass er sich wahrscheinlich nicht so viel Mühe gibt, weil er schon denkt, dass es an seinem fehlenden Talent liegt. Das sehe ich auch so. Ich bin der Meinung, dass er seinen Misserfolg internal variabel attribuieren sollte, damit er die Ursache für seine schlechten Noten in seiner niedrigen Anstrengungsbereitschaft sucht, sofern wir davon ausgehen, dass er sich momentan nicht so sehr anstrengt.",1
"Eine neue Idee zu diesem Fall ist, dass er den Anschein erweckt, als würde er seine Zuversicht dem nächsten Schuljahr gegenüber allerdings mehr dem Zufall zuzuschreiben als seiner eigenen Fähigkeit und Arbeitsbereitschaft. Somit bezieht er seinen Erfolg auf eine externale und variable Attribution statt auf eine internale variable, was im Sinne der Leistungsfähigkeit kontraproduktiv ist.",1
es gehen mißerfolge voraus,1
"Michaels Problem ist, dass er kein Mathematik kann, Ursache dafür sind internale stabile Ereignisse, wie bspw. dass seine Eltern kein Mathe können. Diese hegen auch kein Interesse an seinen Fähigkeiten und motivieren ihn auch nicht. Michale selbst hat aber auch keine Motivation, für Mathe zu lernen (variable stabile Komponente). Nicht fördernd ist außerdem, dass sein Vater ihm erzählt, er selbst hätt seine Matheprüfung nur durch Spicken und Abschreiben bestanden. Es fehlt also die Motivation von innen und von außen. Auch seine Lehrerin scheint sich nicht für ihn zu interessieren, da sie der Meinung ist, Michaels schlechte Noten lägen an seiner Faulheit. Da sich Michael außerdem nicht 100% sicher ist, ob er die Klasse bestehen wird, sieht er sich der Schwierigkeit nicht gewachsen. Eventuell sind auch die Aufgaben für ihn zu schwer.",1
Diese ungünstigen Voraussetzungen,1
"Die Hauptperson hat Probleme mit dem Fach Mathe und wird durch seine Mathelehrerin sowie den Eltern negativ attributiert. Er selbst sagt aus das ihm Mathe nicht liegt und daraus ist eine Lernbereitschaft nicht zu erkennen. Das neue Schuljahr wird für Ihn eine Herausforderung, da er das Alte grade so geschafft hat und Mathe immer noch eine Schwierigkeit für Ihn bereitet.",1
Hypothese zum Fall:,0
michael: stabil,0
Es geht ein Misserfolg im Mathematikunterricht voraus.Die Versetzung in die nächste Klasse ist gefährdet.,1
und die Eltern attribuieren ihn internal,0
gute idee. vielleicht gleich mit diesem?,0
da er seine Miss erfolge auf seine mangelnde Begabung zurückführt.,1
"Ein wichtiges Konzept, was man dabei beachten sollte, ist dass die Eltern die Motivation von Michael automatisch mindern, indem sie es auf eine familiär begründete Nichtbegabung im Bereich Mathematik beziehen. Er könnte sich als unfähig sehen, diese Probleme zu bewältigen, und nur äußere (externale) Faktoren wie Glück oder Zufall könnten ihm helfen.",0
"EIN MIßERFOLG, DA DAS KIND DENK SEINE ELTERN ""WAREN NICHT GUT""IM MATHE  UND LEBEN TROZDEM WARUM SOLL ICH MIR DANN SO VIELE GEDANKEN MACHEN WIE ICH ES WEITER MACHEN SOLL",1
den misserfolg ,1
"Dadurch, das Michael sagt, ""das Mathe einfach nicht sein Fach ist"", führt er seinen Mißerfolg ",1
"Ein wichtiges Konzept, was man dabei beachten sollte, ist Misserfolge bewusst auf variable Ursachen zurückzuführen. So könnte die Lehrerin einreden, dass es ein Zufall gewesen wäre, dass er in der neunten schwache Leistung erbrachte und in der zehnten Klasse andere variable externe Faktoren vorkommen könnten.",1
"Die Schwierigkeit der Hauptperson Michael ist, dass er keine guten Noten in Mathematik hat und diese seine Versetzung gefährden/gefährdet haben. Michael attribuiert seinen Misserfolg in Mathe internal stabil.  Stabil, weil das eine Fähigkeit darstellt und internal, weil es von Michael ausgeht. Michaels eigene Herangehensweise an Mathe ist demnach nicht förderlich für seinen Lernerfolg Michaels Eltern bestätigen Michael external in seiner ungünstige Selbstattribution. Unter anderem halten die Eltern sich und die ganze Familie für unbegabt in Mathe. Ein Reattributionstraining wäre interessant für die Lehrerin und die Eltern. Die Eltern sollten lernen Michael dabei zu unterstützen, Misserfolge auf variable Ursachen zurückzuführen",1
Michael erklärt seine Misserfolge,1
Ich bitte um ein wenig Geduld. Dein Partner hat einige technische Probleme,0
Die Eltern attribuieren den Misserfolg hauptsächlich internal stabil,0
"Information aus dem Fall, die wir noch nicht betrachtet haben, ist, dass man dem Jungen und den Eltern beibringt, den mangelnden Erfolg in Mathe auf mangelnde Anstrengung (internal, variabel) zurückzuführen und wenn man trotzdem mal schlecht ist auf externale, variable Faktoren, wie dass man mal Pech gehabt hat",1
 external,1
 variable Attribution,1
Es geht ein Misserfolg im Mathematikunterricht voraus.Die Versetzung in die nächste Klasse ist gefährdet.,1
"Am motivationsförderlichsten wäre es, ihm internal variable Attributionsmuster beizubringen",1
Michael hat Selbstzweifel an seiner Begabung für Mathe,0
"Du hast gerade etwas gesagt, dem ich zustimme, und zwar, dass er auch versuchen könnte, den Zufall als Ursache für den Misserfolg zu betrachten und dem Zufall könnte er nicht beeinflussen,da die Klassenarbeit zB bei dem nächsten Mal schon wieder vollkommen anders sein könnte. Im Prinzip könnte man allgemein davon ausgehen, dass es sich dabei um eine external variable Attribution handelt, oder was meinst du? Weil die Lehrerin spricht seine Anstrengung an (variabel) und geht also davon aus, dass diese sich verändern kann. Er selbst ist am Ende bisschen offen dafür und lässt es quasi auf sich zukommen, was im neuen Schuljahr kommen wird. Er ist in dieser hinsicht deswegen variabel und nicht stabil, weil er die Veränderung, die stattfinden könnte nicht von vorn herein ausschließt oder dementiert. Er sagt ja selbst ""Das letzte Schuljahr habe ich noch geschafft, aber ich bin wirklich gespannt auf das neue Schuljahr!"" und sagt nicht zB. ""Das nächste Schuljahr werde ich durch Glück schaffen oder allgemein nicht schaffen, weil der Vater gesagt hat, dass die ganze Familie nicht gut in Mathe ist.",1
Einverstanden,0
 und davon aussgeht er sei faul,0
1.Hypothese zum Fall:,0
Durch Lernen und gezielte Förderung lassen sich Schwachstellen verbessern,0
"Michael attribuiert seinen Misserfolg internal stabil, indem er seine mangelnde Begabung dafür verantwortlich macht. Dementsprechend ist er unmotivierter, da er nichts daran ändern kann. Diese Selbstattribuierung wird von der Fremdattribuierung der Eltern verstärkt oder sogar verursacht und übernommen. Diese erzählen von ihren schlechten Matheleistungen und deuten an, dass in der Familie eine Unfähigkeit in Mathe veranlagt ist. Unterstützender wäre eine variable Attribuierung durch Anstrengung oder Lernzeit gewesen oder das Anbieten von Nachhilfe. Die Mathelehrerin Frau Weber reagiert grundsätzlich gut, indem sie versucht, Michaels Misserfolg (internal) variabel durch Anstrengung zu begründen. Sie sagt, dass seine schlechten Noten mit seiner Faulheit und nicht mit fehlender Begabung zu tun haben. Problematisch könnte allerdings der Begriff „Faulheit“ hier sein und der Vorwurf, er würde nach Ausreden suchen. Das könnte eher als Kritik aufgefasst werden und demotivierend wirken, weil Faulheit nach einer stabileren Persönlichkeitseigenschaft klingt. Das Feedback könnte also durch die Art und Weise der Formulierung nicht richtig beim Schüler ankommen.",1
"Wir glauben, dass Michael seine schlechten Leistungen aktuell internal stabil attribuiert und dass er daher nicht motiviert ist, sich anzustrengen, um bessere Leistungen zu erreichen. Wir erachten ein Reattributionstraining sowohl für ihn als auch für seine Eltern als wichtig, um Michael zu einer internal variablen Attribution zu führen, sowohl für Erfolg als auch für Misserfolg.",1
"Du hast gerade geschrieben, dass er seine Leistung internal variabel attribuieren sollte, das heißt auf seine mangelnde Anstrengung zurückführen. Dem stimme ich zu.",1
"Internal, weil er glaubt dass sie ""angeboren"" sind.(Aufgrund der Aussagen der Eltern) ",0
ja hallo,0
"Dadurch, das Michael sagt, ""das Mathe einfach nicht sein Fach ist"", führt er seinen Mißerfolg ",1
"Die Person hat Schwierigkeiten in Mathe, wird jedoch aber durch das persönlich Umfeld beeinflusst",0
weil seine eltern meinten die ganze Familie kann kein mathe so zu guter sprech wirst du auch nicht können,0
"Wir wissen ja nicht, ob der Großteil seiner Klasse schlecht ist, weil die Aufgaben in ihrem Kurs zu schwer sind oder sonstiges",0
"Danke! Ihr könnt den Chat jetzt über den ""Chat Beenden""-Button schließen.",0
"Der Vater macht Glück für seinen Abschluss verantwortlich (Selbstattribution, extern",1
Diese ungünstigen Voraussetzungen,1
 indem sie seine Schwäche ,1
"Für euch zur Info: In den Reitern über dem Chat findet ihr den Fall, die Aufgabenbeschreibung und die Attributionstheorie. Im Chat scrollen könnt ihr, indem ihr das Scroll-Rad der Maus oder die linke Maustaste gedrückt haltet und die Maus dann in dem Chatfenster nach oben oder unten bewegt. Eine weitere Möglichkeit zum Scrollen ist, das Touchpad am Laptop mit zwei Fingern zu bedienen, wenn diese Funktion aktiviert ist. Falls ihr Fragen habt, könnt ihr sie jederzeit stellen.",0
"Es bringt keinen Nutzen sih mit etwas zu ""quälen"" von dem man nicht überzeugt ist.",0
"Aha, das finde ich einen super Vorschlag, den würde ich ergänzen, und zwar dass man ihm auch die Gründe gibt, warm er sich nicht beeinflussen lassen soll. Man könnte ihn ganz konkret darüber aufklären, wie sich Fremdattribution die internal und stabil ist auf jemanden auswirken und welche Vorteile es hat, eine internal variable Attribution zu haben.",1
Dieses Attributionsmuster wird von seinen Eltern unterstützt ->Fremdattribution,0
"Da ich keine Nachricht von Euch habe, weiss ich nicht, wie es euch geht. ",0
Relativierungen des Arguments:,0
zur person michael: er führt seinen misserfolg,1
"Du hast gerade etwas gesagt, dem ich zustimme, und zwar dass er seine Misserfolge ebenfalls variabel und internal attribuieren sollte. Er muss selbst reflektieren und erkennen, dass nur er selbst etwas an der Situation ändern kann. Wie wir schon gesagt haben, spielt sein Umfeld dabei auch eine große Rolle.",1
"Er sollte seine Leistung also eher internal variable attribuieren, damit er sich verbessern kann.",1
"Du hast gerade geschrieben, dass der Schüler die Situation nicht bewältigen kann, da er von seinem Umfeld genau dies suggeriert bekommt. Dem stimme ich teilweise zu. Hört der Schüler auf sein Umfeld, was ganz den Anschein macht, ist es fast unmöglich das nächste Schuljahr zu schaffen, da die ""Anstrengung"" keine bedachte Option ist. Aber",1
Belege und Begründungen:,0
"ich glaube das der zufall der seinem vater schon geholfen hat,auch beim jungen wichtig ist",1
 schlechten Leistungen,1
2. Eltern schieben alles auf die gene,0
"Interessant is auch, wie du schon gesagt hast, wie Fremdattribution in diesem Fall von statten geht. Die Eltern attribuieren seine Probleme durch internal-stabile Faktoren, wie der Begabung. Ich würde eventuell sogar soweit gehen zu sagen, seine Eltern sehen dies als genetische Veranlagung. Die Lehrerin allerdings versucht, Michael dahin zu bewegen, dass er seine schlechte Leistung in Mathematik internal-variabel seiner Anstrengung zuschreibt. Laut 52 ist es ja günstig, Misserfolge auf variable Ursachen wie Anstrengung zurückzuführen.",1
Da Fremdattr. Auswirkungen auf die Selbstatt. haben kann und umgekehrt.,0
 so zum Beispiel? ,0
 schlechten Leistungen,1
"der schüler, bzw. die ",0
"Deshalb fördert sie Michael weniger,da keine Hoffnung besteht",0
 Zufall half beim bestehen:,1
"Bitte schickt nun euer gemeinsames Ergebnis ab und schließt den Chat über den ""Chat Beenden""-Button.",0
"Er sollte seine Leistung also eher internal variable attribuieren, damit er sich verbessern kann.",1
"Vielleicht könnte man es so formulieren: Michael führt seine Probleme in Mathematik auf seine mangelnde Begabung, also eine internal stabile Ursache, zurück. Seine Eltern bestärken ihn durch eine ebensolche Fremdattribution in seiner Ansicht. Michael Mathematiklehrerin versucht ihn durch Reattribution davon zu überzeugen, die Probleme auf mangelnde Anstrengung, also eine internal variable Ursache, zurückzuführen. Michael blickt mit einer großen Unsicherheit in die schulische Zukunft und ist sich nicht sicher, ob er die Schwierigkeiten bewältigen kann.",1
Diese ungünstigen Voraussetzungen,1
In der Tat ist Bagabung nicht der Ursachen der Misserfolge des Schürlers.,0
"also ohne Veränderungen wird der Typ die Schwierigkeiten nicht überwinden, weil der ganze Misserfolg als stabil angesehen wird",1
"Michael scheint seine Misserfolge in Mathe internal und stabil zu attribuieren. Er sieht seine Fähigkeiten in Mathe als Ursache für seine schlechten Leistungen. Diese Selbstattribution wird gestützt von der Fremdattribution seiner Eltern, die auch seine Fähigkeiten als Ursache sehen. Die Fremdattribution seiner Lehrerin sieht anders aus, sie attribuiert seine schlechten Leistungen internal und variabel, nämlich auf seine (fehlende) Anstrengung. Mit seiner bisherigen Selbstattribution wird Michael sich kaum aus seiner Situation lösen können, da er sie als gegeben und nicht veränderbar ansieht. Eine höhere Anstrengung seinerseits ist somit auch nicht zu erwarten. Das Attributionsmuster seiner Lehrerin würde ihm zugute kommen, da er dann überhaupt erst eine Möglichkeit sieht, etwas zu verändern. Dieses Muster sollte daher Michael selbst und zudem auch seinen Eltern nahegebracht werden, damit der Wandel in der Attribution nicht nur aus Michael selbst kommt, sondern auch von seinen Eltern unterstützt wird.",1
"Michael scheint seine Misserfolge in Mathe internal und stabil zu attribuieren. Er sieht seine Fähigkeiten in Mathe als Ursache für seine schlechten Leistungen. Diese Selbstattribution wird gestützt von der Fremdattribution seiner Eltern, die auch seine Fähigkeiten als Ursache sehen. Die Fremdattribution seiner Lehrerin sieht anders aus, sie attribuiert seine schlechten Leistungen internal und variabel, nämlich auf seine (fehlende) Anstrengung. Mit seiner bisherigen Selbstattribution wird Michael sich kaum aus seiner Situation lösen können, da er sie als gegeben und nicht veränderbar ansieht. Eine höhere Anstrengung seinerseits ist somit auch nicht zu erwarten. Das Attributionsmuster seiner Lehrerin würde ihm zugute kommen, da er dann überhaupt erst eine Möglichkeit sieht, etwas zu verändern. Dieses Muster sollte daher Michael selbst und zudem auch seinen Eltern nahegebracht werden, damit der Wandel in der Attribution nicht nur aus Michael selbst kommt, sondern auch von seinen Eltern unterstützt wird.",1
 (welche er nätürlich nicht dem ZUfall zuschieben darf) hat er dann auch mehr Motivation für weitere Gute NOten zu lernen,1
"Eine neue Idee zu diesem Fall ist, dass es dadurch zu einer mangelnden Mptivation kommt",0
Ja,0
da er bisher nur mathemathische misserfolge verzeichen konnte ,1
 dafür verantwortlich ist.,1
