message,epi
Michael ist sicher ein sehr gutes Beispiel ! Ich denke vielen Jugendlichen in der 10. Klasse geht es nicht anders. ,0
"Die Eltern sollten natürlich idealerweise auch eher zum Lernen motivieren, indem sie sagen, dass er das schaffen kann, wenn er sich anstrengt. Aber der Vater hat anscheinend schon in seiner Schülerzeit diese Selbstattribuierungstendenz gehabt.",0
es gehen mißerfolge voraus,1
 für seinen Misserfolg verantwortlich.,1
es gehen mißerfolge voraus,1
"Für euch zur Info: In den Reitern über dem Chat findet ihr den Fall, die Aufgabenbeschreibung und die Attributionstheorie. Im Chat scrollen könnt ihr, indem ihr die linke Maustaste im Chat gedrückt haltet und die Maus dann in dem Chatfenster nach oben oder unten bewegt. Eine weitere Möglichkeit zum Scrollen ist, das Touchpad am Laptop mit zwei Fingern zu bedienen, wenn diese Funktion aktiviert ist. Falls ihr Fragen habt, könnt ihr sie jederzeit stellen.",0
"Die Lehrerin versucht zwar ihn von der stabilen internalen Lokalität auf die variable internale Lokalität zu bekommen, aber es ist schwierig, da Michael seit 10 Jahren glaubt, kein Mathe zu können.",0
Bist du auch da Funchal?,0
"der vater erzählt,dass er selbst nur mit spicken und abschreiben die klausur bestanden hat.",0
 Er begründet seine schlechten mathematischen Leistungen mit Hilfe seiner,1
"Und die Lehrerin hätte anders reagieren können, mit Handlungsvorschlägen und einer Abfrage seiner eigenen Attribution?",0
FÜR DIESEN FALL RELEVANTE BEGRIFFE DER ATTRIBUTIONSTHEORIE:- GEHT DER ATTRIBUTION EIN ERFOLG ODER EIN MISSERFOLG VORAUS?,0
"Ich bin jetzt davon ausgegangen, da er selbst sagt das Mathe nicht sein Fach sei,",0
Michaels schlechte mathematische Leistungen sind auf ungünstige,0
Es geht ein Misserfolg im Mathematikunterricht voraus.Die Versetzung in die nächste Klasse ist gefährdet.,1
"Also ich bin zufrieden, ich denke wir haben noch gesagt, dass wir das mit der Motivation, was ich am Anfang gesagt habe, noch dazumachen könnten, aber muss nicht ;)",0
"damit sie ihrem sohn ebenfalls vermitteln, dass es eine sache der anstrengung ist und nicht des könnens",1
"Danke! Ihr könnt den Chat jetzt über den ""Chat beenden""-Button schließen.",0
"Du hast gerade etwas gesagt, dem ich  zustimme, und zwar dass das Denken seiner Familie nicht förderlich ist. Diese genannten Aspekte sind ausschlaggebend für die Situation. Hinzu kommt, dass der Schüler an Ende sagt, dass er hofft, dass er das nächste Schuljahr schafft. hier sind schon einige Zweifel herauszulesen, die auf diese Elemente zurückzuführen sind.",1
"Information aus dem Fall, die wir noch nicht betrachtet haben, ist, dass man dem Jungen und den Eltern beibringt, den mangelnden Erfolg in Mathe auf mangelnde Anstrengung (internal, variabel) zurückzuführen und wenn man trotzdem mal schlecht ist auf externale, variable Faktoren, wie dass man mal Pech gehabt hat",1
"michael ist nicht der meinung wirklich schlecht in mathe zu sein, er hat einfach keine lust zu lernen",0
- Michael und ,0
"wenn sie andere Attrbutionsarten anwenden, könnte man Peter mehr motivieren",0
 variable Attribution.,1
"Meiner Meinung nach sollte Michael eher den Tipp der Lehrerin befolgen, da sie die Fachkompetenz besitzt",0
klappt bei mir irgendwie nicht,0
Michaels schlechte Leistungen,1
Es geht ein Misserfolg im Mathematikunterricht voraus.Die Versetzung in die nächste Klasse ist gefährdet.,1
"Ich glaube aber,dass er von zu Hause ungünstige Fremdmotivation erhält,da er mangelnde Begabung in Mathe aufgrund der Aussagen der Eltern evtl. für erblich oder mangelnde Fähigkeit hält",0
Michael führt sein Versagen in Mathematik ,1
Belege und Begründungen:,0
"Genau! Aussage der Lehrerin könnte ihn also motivieren zu lernen, im Gegensatz zu den Aussagen der Eltern, Ein wichtiges Konzept, was man dabei beachten sollte, ist, dass sein Vater ihm Außerdem Wege aufzeigt, wie er betrügen kann, um zu bestehen. Wenn er dann Erfolg hat, wird sein Selbstkonzept in Mathe immernoch schlecht bleiben.",0
"Der Vater macht Glück für seinen Abschluss verantwortlich (Selbstattribution, extern",1
"Auch Fremdattribution spielt eine große Rolle. Die Eltern attribuieren den Misserfolg ihres Sohnes auf internal stabile Eigenschaften, was dazu führt, dass der Sohn dies ebenfalls tut. Die Lehrerin hingegen attribuiert sie auf internal variable Zustände, nämlich fehlende Anstrengung. Die internal stabile Fremdattribution der Eltern führt dazu, dass der Sohn keine wirkliche Motivation zeigt, seine Leistung zu verbessern. Die internal variable Attribution der Lehrerin hingegen könnte dem Schüler als Anreiz dienen.",0
 indem sie seine Schwäche ,1
" stabile"" Klassifikation",0
den misserfolg ,1
"Der Schüler wird sich nicht weiter anstrengen, weil er es für sinnlos hält.",0
Ist das eure gemeinsame Analyse und seid ihr beide einverstanden oder wollt noch etwas ergänzen?,0
Belege und Begründungen:,0
Belege und Begründungen:,0
"Du hast gerade etwas gesagt, dem ich zustimme, und zwar, dass die Eltern Michael dahingehend unterstützen sollten, Misserfolge auf variable Ursachen zurückzuführen und von der Stabilität wegzukommen.",1
"Also sind wir uns einig, dass Michael und sein Umfeld ein Reattributionstraining benötigen, damit Michael seinen Misserfolg und seinen Erfolg künftig internal variabel attribuieren kann? Ich denke, dass die Art und Weise, wie seine Lehrerin und seine Eltern seinen Misserfolg beschreiben, für Michael nicht hilfreich ist.",1
1.Hypothese zum Fall:,0
Dem stimme ich zu.,0
"aber auch seine lehrerin sagt ihm, dass er sich anstrengen müsste um weiterzukommen!",0
"oh sorry, hab die passende Stelle gesucht",0
Da bin ich deiner Meinung !,0
jap alles gut so,0
außerdem würde ihm und ,0
manche eltern motivieren ihre kinder und helfen ihnen beim lernen,0
die ausrede einer internal,0
"EIN MIßERFOLG, DA DAS KIND DENK SEINE ELTERN ""WAREN NICHT GUT""IM MATHE  UND LEBEN TROZDEM WARUM SOLL ICH MIR DANN SO VIELE GEDANKEN MACHEN WIE ICH ES WEITER MACHEN SOLL",1
 (welche er nätürlich nicht dem ZUfall zuschieben darf) hat er dann auch mehr Motivation für weitere Gute NOten zu lernen,1
"Du hast gerade geschrieben, dass Michael Peters und Schwierigkeiten in Mathe hat. Dem stimme ich voll zu. Seine Eltern hatten offensichtlich auch Schwierigkeiten in Mathe und scheinen nicht sonderlich überrascht.",0
"Information aus dem Fall, die wir noch nicht betrachtet haben, ist, dass eine Eltern Ihn bei der Ansicht unterstützen",0
Er hofft auf den glücklichen Zufall,1
Belege und Begründungen:,0
"Information aus dem Fall, die wir noch nicht betrachtet haben, ist, dass man dem Jungen und den Eltern beibringt, den mangelnden Erfolg in Mathe auf mangelnde Anstrengung (internal, variabel) zurückzuführen und wenn man trotzdem mal schlecht ist auf externale, variable Faktoren, wie dass man mal Pech gehabt hat",1
"In meinen Augen attribuieren sie seine Erfolge eher internal, nämlich eben auf seine Fähigkeiten. Und ich stimme dir zu, eine Attribution auf variable Faktoren wäre hier bei Misserfolgen sinnvoller.",1
"Die Schwierigkeit der Hauptperson Michael ist, dass er keine guten Noten in Mathematik hat und diese seine Versetzung gefährden/gefährdet haben. Michael attribuiert seinen Misserfolg in Mathe internal stabil.  Stabil, weil das eine Fähigkeit darstellt und internal, weil es von Michael ausgeht. Michaels eigene Herangehensweise an Mathe ist demnach nicht förderlich für seinen Lernerfolg Michaels Eltern bestätigen Michael external in seiner ungünstige Selbstattribution. Unter anderem halten die Eltern sich und die ganze Familie für unbegabt in Mathe. Ein Reattributionstraining wäre interessant für die Lehrerin und die Eltern. Die Eltern sollten lernen Michael dabei zu unterstützen, Misserfolge auf variable Ursachen zurückzuführen",1
Die Lehrerin ist durch diese Aussage der Eltern negativ beeinflusst.,0
Michael sollte seinen Misserfolg,1
 indem sie seine Schwäche ,1
"Also sind wir uns einig, dass Michael und sein Umfeld ein Reattributionstraining benötigen, damit Michael seinen Misserfolg und seinen Erfolg künftig internal variabel attribuieren kann? Ich denke, dass die Art und Weise, wie seine Lehrerin und seine Eltern seinen Misserfolg beschreiben, für Michael nicht hilfreich ist.",1
 external,1
"JA genau, das reicht doch dann so, oder?",0
FÜR DIESEN FALL RELEVANTE BEGRIFFE DER ATTRIBUTIONSTHEORIE:- GEHT DER ATTRIBUTION EIN ERFOLG ODER EIN MISSERFOLG VORAUS?,0
"abe das jetzt erst gerade gesehen, ",0
zumindest eine Falsche,0
Er attribuiert seinen Erfolg external,1
Dem kann ich nur zustimmen.,0
 Außerdem führt er seine misserfolge auf ,1
Der Grund für seine schlechten Noten würde dann in der mangelnden Anstrengung liegen,1
 für seinen Misserfolg verantwortlich.,1
mangelnde Begabung ist kein zwingender Grund für Misserfolg,0
"Du hast gerade etwas gesagt, dem ich zustimme, und zwar, dass er auch versuchen könnte, den Zufall als Ursache für den Misserfolg zu betrachten und dem Zufall könnte er nicht beeinflussen,da die Klassenarbeit zB bei dem nächsten Mal schon wieder vollkommen anders sein könnte. Im Prinzip könnte man allgemein davon ausgehen, dass es sich dabei um eine external variable Attribution handelt, oder was meinst du? Weil die Lehrerin spricht seine Anstrengung an (variabel) und geht also davon aus, dass diese sich verändern kann. Er selbst ist am Ende bisschen offen dafür und lässt es quasi auf sich zukommen, was im neuen Schuljahr kommen wird. Er ist in dieser hinsicht deswegen variabel und nicht stabil, weil er die Veränderung, die stattfinden könnte nicht von vorn herein ausschließt oder dementiert. Er sagt ja selbst ""Das letzte Schuljahr habe ich noch geschafft, aber ich bin wirklich gespannt auf das neue Schuljahr!"" und sagt nicht zB. ""Das nächste Schuljahr werde ich durch Glück schaffen oder allgemein nicht schaffen, weil der Vater gesagt hat, dass die ganze Familie nicht gut in Mathe ist.",1
den misserfolg ,1
"Michaels Problem ist, dass er seine schlechte Mathe-Leistung internal-stabil attribuiert und auf mangelnde Begabung zurückführt. dies ist beeinflusst durch die internal-stabile Attribution seiner Eltern , die meinen, dass die gesamte Famiie vn Natur aus schlecht in Mathe sei. Zudem hat seine Lehrerin eine internal-variable Attribution und hält Michael für faul, was ebenfalls zu seiner schlechten Motivation beiträgt, da es besser wäre ihm eine external-Variable Ursache für seinen Misserfolg zu vermitteln.",1
und motiviet ihn indem sie ihm neue möglichkeiten zeigt und neugierig macht.,0
"okay, ich lege dann einfach mal los :)",0
 variable Attribution,1
"Die Schwierigkeit der Hauptperson Michael ist, dass er keine guten Noten in Mathematik hat und diese seine Versetzung gefährden/gefährdet haben. Michael attribuiert seinen Misserfolg in Mathe internal stabil.  Stabil, weil das eine Fähigkeit darstellt und internal, weil es von Michael ausgeht. Michaels eigene Herangehensweise an Mathe ist demnach nicht förderlich für seinen Lernerfolg Michaels Eltern bestätigen Michael external in seiner ungünstige Selbstattribution. Unter anderem halten die Eltern sich und die ganze Familie für unbegabt in Mathe. Ein Reattributionstraining wäre interessant für die Lehrerin und die Eltern. Die Eltern sollten lernen Michael dabei zu unterstützen, Misserfolge auf variable Ursachen zurückzuführen",1
Belege und Begründungen:,0
Belege und Begründungen:,0
"Dass sie sagen, sie hätten gute Noten schreiben können durch Anstrengung",1
aber ich glaube das beides eine rolle spielt,0
"Ich denke, Michael glaubt nicht, diese Schwierigkeit bewältigen zu können, da er am Ende ja selbst sagt, er habe das letzte Jahr noch gepackt, aber das nächste könnte wohl schwieriger werden.",1
"Selbstattributation der Familie Peters ist, sie hätten keine Begabung für Mathe",0
Michael führt seine schlechten Mathenoten ,1
In Mathe muss man logisch vorgehen um eine Lösung zu erhalten und das fördert dieses Denken.,0
"Information aus dem Fall, die wir noch nicht betrachtet haben, ist die Fremdattribution durch die Lehrerin.",0
"Michaels Problem ist, dass er kein Mathematik kann, Ursache dafür sind internale stabile Ereignisse, wie bspw. dass seine Eltern kein Mathe können. Diese hegen auch kein Interesse an seinen Fähigkeiten und motivieren ihn auch nicht. Michale selbst hat aber auch keine Motivation, für Mathe zu lernen (variable stabile Komponente). Nicht fördernd ist außerdem, dass sein Vater ihm erzählt, er selbst hätt seine Matheprüfung nur durch Spicken und Abschreiben bestanden. Es fehlt also die Motivation von innen und von außen. Auch seine Lehrerin scheint sich nicht für ihn zu interessieren, da sie der Meinung ist, Michaels schlechte Noten lägen an seiner Faulheit. Da sich Michael außerdem nicht 100% sicher ist, ob er die Klasse bestehen wird, sieht er sich der Schwierigkeit nicht gewachsen. Eventuell sind auch die Aufgaben für ihn zu schwer.",1
 internal,0
"Eine neue Idee zu diesem Fall ist, dass er den Anschein erweckt, als würde er seine Zuversicht dem nächsten Schuljahr gegenüber allerdings mehr dem Zufall zuzuschreiben als seiner eigenen Fähigkeit und Arbeitsbereitschaft. Somit bezieht er seinen Erfolg auf eine externale und variable Attribution statt auf eine internale variable, was im Sinne der Leistungsfähigkeit kontraproduktiv ist.",1
"Selbstattributation der Familie Peters ist, sie hätten keine Begabung für Mathe",0
" Er hofft auf sein Glück und läßt das neue Schuljahr auf sich zukommen, ohne irgendwelche Maßnahmen zu ergreifen.",1
Er attribuiert seinen Erfolg external,1
"Michaels Problem ist, dass er kein Mathematik kann, Ursache dafür sind internale stabile Ereignisse, wie bspw. dass seine Eltern kein Mathe können. Diese hegen auch kein Interesse an seinen Fähigkeiten und motivieren ihn auch nicht. Michale selbst hat aber auch keine Motivation, für Mathe zu lernen (variable stabile Komponente). Nicht fördernd ist außerdem, dass sein Vater ihm erzählt, er selbst hätt seine Matheprüfung nur durch Spicken und Abschreiben bestanden. Es fehlt also die Motivation von innen und von außen. Auch seine Lehrerin scheint sich nicht für ihn zu interessieren, da sie der Meinung ist, Michaels schlechte Noten lägen an seiner Faulheit. Da sich Michael außerdem nicht 100% sicher ist, ob er die Klasse bestehen wird, sieht er sich der Schwierigkeit nicht gewachsen. Eventuell sind auch die Aufgaben für ihn zu schwer.",1
"Eine neue Idee zu diesem Fall ist, dass Michael seinen Misserfolg auf internal stabile Faktoren bezieht oder zumindest kurz davor ist.",0
Ja klingt gut.,0
Das mathematische Verständnis kann aber durchaus auch geschult werden durch spezielles Training.,0
Relativierungen des Arguments:,0
"Es ist ein großer Nachteil für ihn, seinenMisserfolg an der eigenen Begabung festzumachen.",0
"Ergänzend kann man noch sagen, dass es günstig gewesen wäre den Schüler zu motivieren, dass er es durch Anstrengung schaffen kann",1
Relativierungen des Arguments:,0
" will ja nicht drängeln, aber...",0
"...und internal ist es glaube ich auch, weil es an ihm liegt, ob er vom Abschreiben Gebrauch macht oder nicht, aber ist nur eine Vermutung haha",0
(--> Misserfolge werden auf,1
"Information aus dem Fall, die wir noch nicht betrachtet haben, ist auch, dass der Vater davon gesprochen hat, das er immer abgeschrieben hat oder gespickt hat. Was ja von seiten eines Elternteils auch nicht gut ist.",0
Der Schüler sollte jedoch auch einen möglichen Grund seiner Probleme in seiner Anstrengung ( internal/ variable) sehen. Zudem sollte er durch seine Eltern und Lehrer besser motiviert werden um eine bessere Leistung zu erreichen.,1
 Zufall half beim bestehen:,1
"Aha, das finde ich einen super Vorschlag, den würde ich ergänzen, und zwar dass man ihm auch die Gründe gibt, warm er sich nicht beeinflussen lassen soll. Man könnte ihn ganz konkret darüber aufklären, wie sich Fremdattribution die internal und stabil ist auf jemanden auswirken und welche Vorteile es hat, eine internal variable Attribution zu haben.",1
 seinen Misserfolg in Mathe,1
 external,1
Michael erklärt seine Misserfolge,1
"also ohne Veränderungen wird der Typ die Schwierigkeiten nicht überwinden, weil der ganze Misserfolg als stabil angesehen wird",1
"Ja, beziehungsweise der Schüler selbst, denn bevor er das Gespräch mit seinen Eltern hatte, hat er selbst seine Begabungen in Frage gestellt.",0
"Interessant is auch, wie du schon gesagt hast, wie Fremdattribution in diesem Fall von statten geht. Die Eltern attribuieren seine Probleme durch internal-stabile Faktoren, wie der Begabung. Ich würde eventuell sogar soweit gehen zu sagen, seine Eltern sehen dies als genetische Veranlagung. Die Lehrerin allerdings versucht, Michael dahin zu bewegen, dass er seine schlechte Leistung in Mathematik internal-variabel seiner Anstrengung zuschreibt. Laut 52 ist es ja günstig, Misserfolge auf variable Ursachen wie Anstrengung zurückzuführen.",1
" Frau Weber versucht ihm klarzumachen, dass seine Misserfolge",1
"denn sie führt seine Leistungen auf mangelnde Anstrengung zurück, ",0
Michaels Misserfolge ,1
"Du hast gerade geschrieben, dass er seine Leistung internal variabel attribuieren sollte, das heißt auf seine mangelnde Anstrengung zurückführen. Dem stimme ich zu.",1
"Du hast gerade etwas gesagt, dem ich zustimme, und zwar dass man ihn aufklären sollte, wie sich Fremdattribution auswirkt.",0
"Du hast gerade geschrieben, dass er sich wahrscheinlich nicht so viel Mühe gibt, weil er schon denkt, dass es an seinem fehlenden Talent liegt. Das sehe ich auch so. Ich bin der Meinung, dass er seinen Misserfolg internal variabel attribuieren sollte, damit er die Ursache für seine schlechten Noten in seiner niedrigen Anstrengungsbereitschaft sucht, sofern wir davon ausgehen, dass er sich momentan nicht so sehr anstrengt.",1
"Für euch zur Info: In den Reitern über dem Chat findet ihr den Fall, die Aufgabenbeschreibung und die Attributionstheorie. Falls ihr Fragen habt, könnt ihr sie jederzeit stellen.",0
ATTRIBUTIONEN WIRKEN SICH FOLGENDERMAßEN AUF DAS LERNEN AUS,0
lehrerin sollte versuchen durch eine günstigere fremdattribution ihren schüler zu motivieren,0
"Du hast gerade etwas gesagt, dem ich zustimme, und zwar, dass die Eltern Michael dahingehend unterstützen sollten, Misserfolge auf variable Ursachen zurückzuführen und von der Stabilität wegzukommen.",1
lehrerin sollte versuchen durch eine günstigere fremdattribution ihren schüler zu motivieren,0
"Information aus dem Fall, die wir noch nicht betrachtet haben, ist, dass man dem Jungen und den Eltern beibringt, den mangelnden Erfolg in Mathe auf mangelnde Anstrengung (internal, variabel) zurückzuführen und wenn man trotzdem mal schlecht ist auf externale, variable Faktoren, wie dass man mal Pech gehabt hat",1
Seid ihr beide einverstanden mit der gemeinsamen Erklärung oder möchre noch jemand etwas ergänzen?,0
"Der Vater sagt, dass er kein MAthe konnte.",0
"Ich denke, dass die hauptperson, in diesem Fall der Schüler die Schwierigkeit hat, durch sein Umfeld (Fremdattribution) negativ und vor allem einseitig beeinflusst zu werden, was gleichzeitig seinen Gedankenhorizont verkleinert und determiniert.",0
Eins und eins nicht zusammen zählen zu können brächte uns auch mit Taschenrechnern in unangenehme Situationen.,0
Peters Problem: Er schreibt schlechte Noten in Mathe und denkt er könne nichts daran ändern. Peter schreibt seine schlechten Noten hauptsächlich einer nicht vorhandenen Begabung in Mathe zu. Er erwartet das nächste Schuljahr nur knapp oder nicht zu meistern.,1
"Sollen wir nochmal unsere einzelnen Punkte zusammenfassen, damit wir dann ein gemeinsames Ergebnis formulieren können?",0
"Ein wichtiges Konzept, was man dabei beachten sollte, ist Misserfolge bewusst auf variable Ursachen zurückzuführen. So könnte die Lehrerin einreden, dass es ein Zufall gewesen wäre, dass er in der neunten schwache Leistung erbrachte und in der zehnten Klasse andere variable externe Faktoren vorkommen könnten.",1
Hallo,0
 Matheschwäche auf ,1
Die Eltern unterstützen die Ansicht ihres Sohns und grinsen und sehen das Ganze allgemein nicht so ernst.,0
"Michael ist schlecht in Mathe. Er ist über seine eigenen Fähigkeiten verunsichrt. Seine Lehrerin attribuiert seine Lesitugn auf seine mangelnde Anstrengung. Seine eltern attribuieren seine Leistung auf die generelle familliäre unfähigkeit im Bereich mathematik. Um sich klarer zu werden, ob er das nächste Schuljahr schaffen kann, auf das er ""gespannt"" ist, trotz der aktuellen schlechten Leistungen in Mathe, geht er auf eine neutrale außenstehende Person, den Schulpsychologen, zu.",0
Er schreibt seine schlechten Noten,1
"Sorry Birke, wenn man an der Arg. schreibt, kann man die Namen plötzlich nicht mehr lesen~ gelesen habe ich sie -Danke",0
Die Äußerung der Lehrerin auf dem fest ist dann bestimmt nicht sehr motivierend für Michi!,0
 indem sie seine Schwäche ,1
"Interessant is auch, wie du schon gesagt hast, wie Fremdattribution in diesem Fall von statten geht. Die Eltern attribuieren seine Probleme durch internal-stabile Faktoren, wie der Begabung. Ich würde eventuell sogar soweit gehen zu sagen, seine Eltern sehen dies als genetische Veranlagung. Die Lehrerin allerdings versucht, Michael dahin zu bewegen, dass er seine schlechte Leistung in Mathematik internal-variabel seiner Anstrengung zuschreibt. Laut 52 ist es ja günstig, Misserfolge auf variable Ursachen wie Anstrengung zurückzuführen.",1
Cie Fremdattribution wird von dem Schüler übernommen und wirkt sich negativ auf sein Lernverhalten aus.,0
"Eine neue Idee zu diesem Fall ist aber auch, dass der Junge am Ende doch eher davon ausgeht, dass er es nicht schaffen wird. Zumindest lässt der Wortlaut vom letzten Satz darauf schließen. Meiner Meinung nach ist er nämlich doch davon überzeugt, dass seine Fähigkeit zu lernen rein von seiner angeborenen Begabung abhängt und, dass Anstrengung nur eine sekundäre Rolle für ihn spielt. Hieran sieht man finde ich sehr schön, dass der Schüler und seine Familie im Gegensatz zur Lehrerin den Erfolg in dem Fach anders begründen.",1
Michael führt sein Versagen in Mathematik ,1
"Du hast gerade geschrieben, dass der Schüler die Situation nicht bewältigen kann, da er von seinem Umfeld genau dies suggeriert bekommt. Dem stimme ich teilweise zu. Hört der Schüler auf sein Umfeld, was ganz den Anschein macht, ist es fast unmöglich das nächste Schuljahr zu schaffen, da die ""Anstrengung"" keine bedachte Option ist. Aber",1
ein Misserfolg: letzte Klasse gerade noch geschafft,1
Internal-,0
"Aha, das finde ich einen super Vorschlag, den würde ich ergänzen, und zwar dass man ihm auch die Gründe gibt, warm er sich nicht beeinflussen lassen soll. Man könnte ihn ganz konkret darüber aufklären, wie sich Fremdattribution die internal und stabil ist auf jemanden auswirken und welche Vorteile es hat, eine internal variable Attribution zu haben.",1
"Denkt man das Versagen in der Mathe-Klausur auf sein eigenes Versagen zurückführen zu können und machen einem auch noch die Anderen den Vorwurf sich nicht genügend bemüht zu haben, hat man bald keine Lust mehr irgendetwas zu tun",0
Michael Peters beschreibt seine Matheleistungen an Hand der Attrbuntionstheorie als internal ,0
"Und jetzt ist er ja gespannt, was das nächste Schuljahr (10.) mit sich bringt, oder?",0
"Die Schwierigkeit der Hauptperson Michael ist, dass er keine guten Noten in Mathematik hat und diese seine Versetzung gefährden/gefährdet haben. Michael attribuiert seinen Misserfolg in Mathe internal stabil.  Stabil, weil das eine Fähigkeit darstellt und internal, weil es von Michael ausgeht. Michaels eigene Herangehensweise an Mathe ist demnach nicht förderlich für seinen Lernerfolg Michaels Eltern bestätigen Michael external in seiner ungünstige Selbstattribution. Unter anderem halten die Eltern sich und die ganze Familie für unbegabt in Mathe. Ein Reattributionstraining wäre interessant für die Lehrerin und die Eltern. Die Eltern sollten lernen Michael dabei zu unterstützen, Misserfolge auf variable Ursachen zurückzuführen",1
"wenn nicht, dann bin ich auch einverstanden",0
1. die eltern,0
bitte schlussanayse anschauen!,0
1.Hypothese zum Fall:,0
Diese ungünstigen Voraussetzungen,1
viel zu große beeinflussung der eltern,0
"Also sind wir uns einig, dass Michael und sein Umfeld ein Reattributionstraining benötigen, damit Michael seinen Misserfolg und seinen Erfolg künftig internal variabel attribuieren kann? Ich denke, dass die Art und Weise, wie seine Lehrerin und seine Eltern seinen Misserfolg beschreiben, für Michael nicht hilfreich ist.",1
"Information aus dem Fall, die wir noch nicht betrachtet haben, ist, dass man dem Jungen und den Eltern beibringt, den mangelnden Erfolg in Mathe auf mangelnde Anstrengung (internal, variabel) zurückzuführen und wenn man trotzdem mal schlecht ist auf externale, variable Faktoren, wie dass man mal Pech gehabt hat",1
"Die einen müssen eben mehr dafür tun, die anderen weniger",0
"Wenn michael es schafft, seine schlechten Leistungen als internal variabel auf seine Anstregnung zu attribuieren, dann kann ihn das für die zukunft motivieren, besser in mathe zu werden",1
wie wollen wir es machen?`,0
"Vielleicht könnte man es so formulieren: Michael führt seine Probleme in Mathematik auf seine mangelnde Begabung, also eine internal stabile Ursache, zurück. Seine Eltern bestärken ihn durch eine ebensolche Fremdattribution in seiner Ansicht. Michael Mathematiklehrerin versucht ihn durch Reattribution davon zu überzeugen, die Probleme auf mangelnde Anstrengung, also eine internal variable Ursache, zurückzuführen. Michael blickt mit einer großen Unsicherheit in die schulische Zukunft und ist sich nicht sicher, ob er die Schwierigkeiten bewältigen kann.",1
