message,epi
"1. Kurze Zusammenfassung der Situation und Schilderung der Problematik: Michael Peters hat enorme Schwierigkeiten in dem Fach Mathematik, weshalb seine Versetzung in die nächste Klassenstufe gefährdet ist. Die Lehrperson macht ihm dies klar und Michael erzählt dies auch seinen Eltern. Die Eltern reagieren nicht wirklich darauf und rechtfertigen seine schlechten Matheleistungen mit einer ""Matheschwäche"", die in der Familie liegt. Michael nimmt dies so hin und gibt den Sachverhalt genau so an seine Lehrerin weiter und erzählt ihr, dass all seine Familienmitglieder Schwierigkeiten in Mathe hatten.                      2. Schwierigkeitsbewältigung und die Gründe und Faktoren: Michael nimmt dies einfach so hin, ohne Anstalten zu machen sich in der nächsten Zeit zu verbessern. Die Eltern sind kein gutes Vorbild und nehmen die Probleme ihres Sohnes nicht ernst. So findet keine Förderung des Kindes seitens des Elternhauses statt. Auch die Lehrperson ist keine große Hilfe, denn sie verdeutlicht ihm zwar die Problematik, aber bietet ihm keine Hilfe an. (Fremdattribution Zeile 72). Dies sind alles Faktoren, die die Situation beeinflussen. Auch die Motivation bzw. die Bereitschaft etwas an der Situation zu ändern besteht nicht. Schließlich ist es von großem Nachteil, wenn Misserfolge auf die mangelnde eigene Begabung zurückgeführt werden. ""In diesem Fall erscheint es für einen Schüler aussichtslos, sich weiter anzustrengen, da man ja zu wissen glaubt, dass man sich für den entsprechenden Bereich unbegabt glaubt und daran nichts zu ändern ist."" (siehe Infotext, Zeile 56ff.)",0
günstigere selbstattributionführt zu lernmotivation,0
" und macht seine Leistung auch ein wenig Zufallsabhängig(""aber ich bin wirklich gespannt auf das neue Schuljahr)-",1
"Ein wichtiges Konzept, was man dabei beachten sollte, ist Misserfolge bewusst auf variable Ursachen zurückzuführen. So könnte die Lehrerin einreden, dass es ein Zufall gewesen wäre, dass er in der neunten schwache Leistung erbrachte und in der zehnten Klasse andere variable externe Faktoren vorkommen könnten.",1
"in der zehnten jedoch wird er von beiden ungünstigen atributionen dermassen beeinflusst, dass er nicht wirklich glaubt es nocheinmal zu schaffen.",0
Hast du Recht.,0
"(und keine Angst machen, dass er das nächste Jahr nicht schafft).",0
"und stabil ist es bestimmt, da er bei den nächsten Prüfungen bestimmt nicht motivierter ist. All das geht aber von der Fremdattribution aus.",0
 er denkt das auch von sich.,0
1. Lehrerin:,0
"Ihre Erlärung laß den MIchael in Überzeugung,daß es sich bei der Sache schon nichts mehr ändern lässt.",0
"Eine neue Idee zu diesem Fall ist zu schauen, wie der Junge in den nächsten Jahren damit umgehen wird. Sein bisheriges Attributionsmuster wird ihn wohl kaum dazu bewegen, viel für Mathe zu arbeiten und sich somit immer wieder selbst bestätigen.",1
"Fakt ist, dass es Kinder gibt die besser mit Mathe umgehen als andere.",0
"zudem müsste die Lehrerin meines Erachtens ihre Einstellung ebenfalls verändern, um die Meinung von Michael änndern zu können",0
"Michael attribuiert seinen Misserfolg internal stabil, indem er seine mangelnde Begabung dafür verantwortlich macht. Dementsprechend ist er unmotivierter, da er nichts daran ändern kann. Diese Selbstattribuierung wird von der Fremdattribuierung der Eltern verstärkt oder sogar verursacht und übernommen. Diese erzählen von ihren schlechten Matheleistungen und deuten an, dass in der Familie eine Unfähigkeit in Mathe veranlagt ist. Unterstützender wäre eine variable Attribuierung durch Anstrengung oder Lernzeit gewesen oder das Anbieten von Nachhilfe. Die Mathelehrerin Frau Weber reagiert grundsätzlich gut, indem sie versucht, Michaels Misserfolg (internal) variabel durch Anstrengung zu begründen. Sie sagt, dass seine schlechten Noten mit seiner Faulheit und nicht mit fehlender Begabung zu tun haben. Problematisch könnte allerdings der Begriff „Faulheit“ hier sein und der Vorwurf, er würde nach Ausreden suchen. Das könnte eher als Kritik aufgefasst werden und demotivierend wirken, weil Faulheit nach einer stabileren Persönlichkeitseigenschaft klingt. Das Feedback könnte also durch die Art und Weise der Formulierung nicht richtig beim Schüler ankommen.",1
"Interessant is auch, wie du schon gesagt hast, wie Fremdattribution in diesem Fall von statten geht. Die Eltern attribuieren seine Probleme durch internal-stabile Faktoren, wie der Begabung. Ich würde eventuell sogar soweit gehen zu sagen, seine Eltern sehen dies als genetische Veranlagung. Die Lehrerin allerdings versucht, Michael dahin zu bewegen, dass er seine schlechte Leistung in Mathematik internal-variabel seiner Anstrengung zuschreibt. Laut 52 ist es ja günstig, Misserfolge auf variable Ursachen wie Anstrengung zurückzuführen.",1
"Ein wichtiges Konzept, was man dabei beachten sollte, ist, dass sie das Hauptaugenmerk auf variable Faktoren  legen sollen, die internal sind",1
" und macht seine Leistung auch ein wenig Zufallsabhängig(""aber ich bin wirklich gespannt auf das neue Schuljahr)-",1
"Du hast gerade geschrieben, dass die Eltern ebenfalls internal stabil attribuieren, dem stimme ich zu!",0
"Könnte man dann also sagen, er hat eine internale stabile Attribution (oder er und seine Eltern gehen zumindest davon aus), obwohl es genauso gut einfach eine internale variable Attribution sein könnte, weil er sich vielleicht einfach nur etwas mehr anstrengen muss?",1
Sie versucht also durch Fremdattribution,0
"xEs handelt sich hierbei um einen Schüler, der In Mathe Misserfolge zeigt.",1
"Die Person hat Schwierigkeiten in Mathe, wird jedoch aber durch das persönlich Umfeld beeinflusst",0
"Durch ausreichend Unterstützung aus dem Umfeld (Eltern und Lehrer) kann man durchaus auch schwerere Aufgaben der Mathematik bewältigen, dies bleibt nicht nur den Begabteren vorbehalten.",0
Belege und Begründungen:,0
"Du hast gerade etwas gesagt, dem ich  zustimme, und zwar dass das Denken seiner Familie nicht förderlich ist. Diese genannten Aspekte sind ausschlaggebend für die Situation. Hinzu kommt, dass der Schüler an Ende sagt, dass er hofft, dass er das nächste Schuljahr schafft. hier sind schon einige Zweifel herauszulesen, die auf diese Elemente zurückzuführen sind.",1
Er schreibt seine schlechten Noten,1
Michael führt sein Versagen in Mathematik ,1
 external,1
"Du hast gerade geschrieben, dass er seine Leistung internal variabel attribuieren sollte, das heißt auf seine mangelnde Anstrengung zurückführen. Dem stimme ich zu.",1
"Eine neue Idee zu diesem Fall ist zu schauen, wie der Junge in den nächsten Jahren damit umgehen wird. Sein bisheriges Attributionsmuster wird ihn wohl kaum dazu bewegen, viel für Mathe zu arbeiten und sich somit immer wieder selbst bestätigen.",1
Du hast recht. Da seine Attribution zuerst kam ist das das Hauptproblem,0
Relativierungen des Arguments:,0
Diese ungünstigen Voraussetzungen,1
Ja,0
" Er macht seinen Mißerfolg daran fest, dass er nicht begabt genug sei.",1
"Ja, hat gut funktioniert",0
Michael führt sein Versagen in Mathematik ,1
Willst du die Analyse schreiben ?,0
zur person michael: er führt seinen misserfolg,1
"EIN MIßERFOLG, DA DAS KIND DENK SEINE ELTERN ""WAREN NICHT GUT""IM MATHE  UND LEBEN TROZDEM WARUM SOLL ICH MIR DANN SO VIELE GEDANKEN MACHEN WIE ICH ES WEITER MACHEN SOLL",1
- IST DIE LOKALITÄT DER ATTRIBUTION INTERNAL ODER EXTERNAL?,0
Gut. Somit haben wir das Reattributionstraining auch erwähnt!,0
"also ohne Veränderungen wird der Typ die Schwierigkeiten nicht überwinden, weil der ganze Misserfolg als stabil angesehen wird",1
Misserfolg,1
*wir wären dann fertig,0
"Michael hat Schwierigkeiten in dem Fach Mathematik. Letztes Jahr hat er gerade so bestanden. Michael begründet seinen Misserfolg in Mathematik internal stabil, nämlich mit mangelnder Begabung. Dies führt dazu, dass er es aussichtslos sieht sich weiter anzustrengen. Unter genauerer Beobachtung sieht man, dass einerseits die Eltern, andererseits die Lehrkraft ihm seinen Misserfolg zuschreiben. Seine Eltern schreiben seinem Misserfolg in Mathematik external stabile Ursachen zu, nämlich, dass die ganze Familie schon immer unbegabt war. Michael übernimmt diese Ansicht, ist unmotiviert und nutzt das Verhalten seiner Eltern als Ausrede. Durch die Fremdattributionen seiner Eltern geht Michael nicht davon aus, die Schwierigkeit (Mathematik im neuen Schuljahr) bewältigen zu können. Die Lehrkraft hingegen interpretiert seinen Misserfolg internal variabel, als Faulheit",1
Peters Problem: Er schreibt schlechte Noten in Mathe und denkt er könne nichts daran ändern. Peter schreibt seine schlechten Noten hauptsächlich einer nicht vorhandenen Begabung in Mathe zu. Er erwartet das nächste Schuljahr nur knapp oder nicht zu meistern.,1
Oder er ist sich bewusst dass er zu wenig gelernt hat und weiss durch Anstrengung beim nächsten Mal kann es besser laufen.,0
Vater bei seiner Abschlussprüfung gespickt hat und abgeschrieben hat,0
Ist Celle auch da?,0
"Du hast gerade etwas gesagt, dem ich teilweise zustimme, und zwar dass man bei dem Begriff 'schlechte Leistung' hier vorsichtig sein muss. Ich denke allerdings, da sowohl der Schüler von sich aus, als auch die Einschätzung der Lehrerin sowie die der Eltern von einer mangelhaften Leistung ausgehen, dass von einer Minderleistung des Schülers in diesem Fach wohl auszugehen ist. Allerdings hast du recht, dass man diskutieren kann, inwiefern diese Leistungen von seiner generellen Leistungsfähigkeit oder Begabung abhängig sind oder wie diese Leistungen verbessert werden könnten.",0
"Ich würde nochmal eine Endfassung skizzieren und wenn du dieser zustimmst, wären wir fertig",0
"Dass sie sagen, sie hätten gute Noten schreiben können durch Anstrengung",1
 Er begründet seine schlechten mathematischen Leistungen mit Hilfe seiner,1
"Natürlich kommen zudem noch Aspekte wie die Schwierigkeit des Schuljahres etc. hinzu, diese lassen sich allerdings auch nicht wirklich aus dem Text erschließen.",0
"External, es scheint nicht an der Aufgabenschwierigkeit zu liegen, die wird nicht kritisiert.",0
"Michaels Problem ist, dass er seine schlechte Mathe-Leistung internal-stabil attribuiert und auf mangelnde Begabung zurückführt. dies ist beeinflusst durch die internal-stabile Attribution seiner Eltern , die meinen, dass die gesamte Famiie vn Natur aus schlecht in Mathe sei. Zudem hat seine Lehrerin eine internal-variable Attribution und hält Michael für faul, was ebenfalls zu seiner schlechten Motivation beiträgt, da es besser wäre ihm eine external-Variable Ursache für seinen Misserfolg zu vermitteln.",1
stimmt!,0
"Ein wichtiges Konzept, was man dabei beachten sollte, ist, dass sie das Hauptaugenmerk auf variable Faktoren  legen sollen, die internal sind",1
"Eine neue Idee zu diesem Fall ist zu schauen, wie der Junge in den nächsten Jahren damit umgehen wird. Sein bisheriges Attributionsmuster wird ihn wohl kaum dazu bewegen, viel für Mathe zu arbeiten und sich somit immer wieder selbst bestätigen.",1
"Eine neue Idee zu diesem Fall ist zu schauen, wie der Junge in den nächsten Jahren damit umgehen wird. Sein bisheriges Attributionsmuster wird ihn wohl kaum dazu bewegen, viel für Mathe zu arbeiten und sich somit immer wieder selbst bestätigen.",1
Michael erklärt seine Misserfolge,1
"Für euch zur Info: In den Reitern über dem Chat findet ihr den Fall, die Aufgabenbeschreibung und die Attributionstheorie. Im Chat scrollen könnt ihr, indem ihr die linke Maustaste im Chat gedrückt haltet und die Maus dann in dem Chatfenster nach oben oder unten bewegt. Eine weitere Möglichkeit zum Scrollen ist, das Touchpad am Laptop mit zwei Fingern zu bedienen, wenn diese Funktion aktiviert ist. Falls ihr Fragen habt, könnt ihr sie jederzeit stellen.",0
Eine neue Idee zu diesem Fall ist,0
 Matheschwäche auf ,1
" Er macht seinen Mißerfolg daran fest, dass er nicht begabt genug sei.",1
1.Hypothese zum Fall:,0
"variabler Faktor), ",1
 variable Attribution,1
"Du hast gerade geschrieben, dass beide ihren Misserfolg stabil internal attribuieren. Dem stimme ich zu, sie denken sie seien nicht begabt.",0
Michael führt sein Versagen in Mathematik ,1
"Michael wird nicht gefördert, er wird sogar demotiviert!",0
"Du hast gerade etwas gesagt, dem ich nicht zustimme, und zwar dass er nur diue negativen aspekte aus dem Lehrergespräch mitnimmt. er ignoriert die aussagen, weil er sie nicht in Verbindung mit seinem abschneiden sieht.",0
Ja,0
In den Worten der Theorie ist es ein internal variabler Faktor,0
internal,0
Total! Dem mit den Eltern kann ich voll zustimmen,0
"EIN MIßERFOLG, DA DAS KIND DENK SEINE ELTERN ""WAREN NICHT GUT""IM MATHE  UND LEBEN TROZDEM WARUM SOLL ICH MIR DANN SO VIELE GEDANKEN MACHEN WIE ICH ES WEITER MACHEN SOLL",1
"Du hast gerade geschrieben, dass er sich wahrscheinlich nicht so viel Mühe gibt, weil er schon denkt, dass es an seinem fehlenden Talent liegt. Das sehe ich auch so. Ich bin der Meinung, dass er seinen Misserfolg internal variabel attribuieren sollte, damit er die Ursache für seine schlechten Noten in seiner niedrigen Anstrengungsbereitschaft sucht, sofern wir davon ausgehen, dass er sich momentan nicht so sehr anstrengt.",1
"Am motivationsförderlichsten wäre es, ihm internal variable Attributionsmuster beizubringen",1
Belege und Begründungen:,0
"Irgendwie hat es gerade abgeschickt, obwohl ich nicht fertig war.",0
gut,0
"Eine neue Idee zu diesem Fall ist zudem, auch eine internale variable Attribution zu fördern, also den Fokus auf den eigenen Fleiß und Einsatz. Dieser Fokus kommt weder in der Selbstattribution des Jungen, noch in der Selbst- und Fremdattribution der Eltern.",1
Er hofft auf den glücklichen Zufall,1
Michael führt seine schlechten Mathenoten ,1
 external,1
"Bin ich auch der Meinung,",0
FOLGENDE PUNKTE BEZIEHEN SICH NICHT AUF DIE ATTRIBUTIONSTHEORIE:,0
"Bevor wir anfangen, könnt ihr mir bestätigen, dass das Halbsätze-Tool bei euch richtig funktioniert? Bitte wählt dazu einen Halbsatz aus und postet ihn in den Chat.",0
"Seine Eltern sind nicht glücklich über die mangelhaften Leistungen ihres Sohnes, führen es aber auf Veranlagung zurück (""Wir waren alle schlecht"" intern stabiler Faktor) und meinen deshalb, man könne an der Situation des Sohnes nichts ändern ",1
Belege und Begründungen:,0
"Allerdings hat sie seine schlechten Leistungen mit der mangelnden Anstrengung begründet, was ja eher förderlich für die Motivation ist.",0
"Michael scheint seine Misserfolge in Mathe internal und stabil zu attribuieren. Er sieht seine Fähigkeiten in Mathe als Ursache für seine schlechten Leistungen. Diese Selbstattribution wird gestützt von der Fremdattribution seiner Eltern, die auch seine Fähigkeiten als Ursache sehen. Die Fremdattribution seiner Lehrerin sieht anders aus, sie attribuiert seine schlechten Leistungen internal und variabel, nämlich auf seine (fehlende) Anstrengung. Mit seiner bisherigen Selbstattribution wird Michael sich kaum aus seiner Situation lösen können, da er sie als gegeben und nicht veränderbar ansieht. Eine höhere Anstrengung seinerseits ist somit auch nicht zu erwarten. Das Attributionsmuster seiner Lehrerin würde ihm zugute kommen, da er dann überhaupt erst eine Möglichkeit sieht, etwas zu verändern. Dieses Muster sollte daher Michael selbst und zudem auch seinen Eltern nahegebracht werden, damit der Wandel in der Attribution nicht nur aus Michael selbst kommt, sondern auch von seinen Eltern unterstützt wird.",1
 indem sie seine Schwäche ,1
- ATTRIBUIERT DER BETROFFENE SELBST ODER WIRD VON AUßEN FREMD ATTRIBUIERT?,0
"Wir glauben, dass Michael seine schlechten Leistungen aktuell internal stabil attribuiert und dass er daher nicht motiviert ist, sich anzustrengen, um bessere Leistungen zu erreichen. Wir erachten ein Reattributionstraining sowohl für ihn als auch für seine Eltern als wichtig, um Michael zu einer internal variablen Attribution zu führen, sowohl für Erfolg als auch für Misserfolg.",1
"Eine neue Idee zu diesem Fall ist aber auch, dass der Junge am Ende doch eher davon ausgeht, dass er es nicht schaffen wird. Zumindest lässt der Wortlaut vom letzten Satz darauf schließen. Meiner Meinung nach ist er nämlich doch davon überzeugt, dass seine Fähigkeit zu lernen rein von seiner angeborenen Begabung abhängt und, dass Anstrengung nur eine sekundäre Rolle für ihn spielt. Hieran sieht man finde ich sehr schön, dass der Schüler und seine Familie im Gegensatz zur Lehrerin den Erfolg in dem Fach anders begründen.",1
Durch die Demotivation seiner Eltern wird Michael nicht zu Anstrengung gefordert,0
"Also sind wir uns einig, dass Michael und sein Umfeld ein Reattributionstraining benötigen, damit Michael seinen Misserfolg und seinen Erfolg künftig internal variabel attribuieren kann? Ich denke, dass die Art und Weise, wie seine Lehrerin und seine Eltern seinen Misserfolg beschreiben, für Michael nicht hilfreich ist.",1
"Hallo, wilkommen in der Chatumgebung!",0
Er attribuiert seinen Erfolg external,1
"Du hast gerade etwas sehr Ähnliches geschrieben, dem stimme ich ebenfalls zu!",0
Der Grund für seine schlechten Noten würde dann in der mangelnden Anstrengung liegen,1
Misserfolg,1
"also ohne Veränderungen wird der Typ die Schwierigkeiten nicht überwinden, weil der ganze Misserfolg als stabil angesehen wird",1
Er hofft auf den glücklichen Zufall,1
da sie den Mißerfolg ,1
Und durch die fehlenden Hilfestellungen der Lehrkraft keine alternativen Attribuierungen aufgezeigt bekommt,0
"Wenn man dann die schlechten Leistungen auf die Person zurückführt und dann noch so tut, als ob diese Leistungen zeitlich stabil sind, demotiviert man die Jugendlichen immer mehr. ",0
Michael begründet seine Misserfolge ,1
"Ich hab's so verstanden, dass man des über mail machen soll.",0
"  aufgrund seiner Matheschwäche,",1
"Die Hauptperson hat Probleme mit dem Fach Mathe und wird durch seine Mathelehrerin sowie den Eltern negativ attributiert. Er selbst sagt aus das ihm Mathe nicht liegt und daraus ist eine Lernbereitschaft nicht zu erkennen. Das neue Schuljahr wird für Ihn eine Herausforderung, da er das Alte grade so geschafft hat und Mathe immer noch eine Schwierigkeit für Ihn bereitet.",1
wirken sich ungüstig,0
"Für euch zur Info: In den Reitern über dem Chat findet ihr den Fall, die Aufgabenbeschreibung und die Attributionstheorie. Falls ihr Fragen habt, könnt ihr sie jederzeit stellen.",0
"Zudem sind die Eltern zu sehr ""entschuldigend"" darüber, dass der Sohn schlechte Noten schreibt, weil sie es auch nicht besser konnten. Es wäre sinnvoll, wenn sie ihm dies nicht mehr so oft sagten, sondern sich eher darauf fokussieren, dass Mathematik sehr wohl ein wichtiges, ernst zu nehmendes Fach ist.",0
Ich bin einverstanden,0
Michael führt sein Versagen in Mathematik ,1
"dann hat er sich von seinen mißerfolgen nicht abbringen lassen,",1
"stabiles Problem, ",0
Willst du Aufgabe 1 oder 2? Danach können wir gegenseitig ergänzen,0
Der Schüler sollte jedoch auch einen möglichen Grund seiner Probleme in seiner Anstrengung ( internal/ variable) sehen. Zudem sollte er durch seine Eltern und Lehrer besser motiviert werden um eine bessere Leistung zu erreichen.,1
 external,1
"Ja, das passt so. Die gemeinsame Analyse in diesen Chat hier posten.",0
Mangelnde Begabung oder schwierigkeiten in einem Fach kann ein Grund,0
ja ich denke auch,0
oder wie sollen wir denn jetzt hier die Analyse verfassen?,0
"Dass sie sagen, sie hätten gute Noten schreiben können durch Anstrengung",1
Der Schüler sollte jedoch auch einen möglichen Grund seiner Probleme in seiner Anstrengung ( internal/ variable) sehen. Zudem sollte er durch seine Eltern und Lehrer besser motiviert werden um eine bessere Leistung zu erreichen.,1
Bitte kommt nun zusammen zu einer Erklärung und schreibt die gemeinsame Analyse am Ende in den Chat.,0
Da er seinen Misserfolg auf mangelnde eigene Begabung zurückführt.,0
Er attribuiert seinen Erfolg external,1
"Du hast gerade etwas gesagt, dem ich zustimme, und zwar, dass die Eltern Michael dahingehend unterstützen sollten, Misserfolge auf variable Ursachen zurückzuführen und von der Stabilität wegzukommen.",1
Kein Text,0
"Dadurch, das Michael sagt, ""das Mathe einfach nicht sein Fach ist"", führt er seinen Mißerfolg ",1
Er hofft auf den glücklichen Zufall,1
Er hofft auf den glücklichen Zufall,1
Michaels eltern führen die schlechte Leistung sowohl auf internale stablie attributoren zurück wie Begabung und zusätzlich auf externale Variablen wie die Lehrkraft.,0
"Auch Fremdattribution spielt eine große Rolle. Die Eltern attribuieren den Misserfolg ihres Sohnes auf internal stabile Eigenschaften, was dazu führt, dass der Sohn dies ebenfalls tut. Die Lehrerin hingegen attribuiert sie auf internal variable Zustände, nämlich fehlende Anstrengung. Die internal stabile Fremdattribution der Eltern führt dazu, dass der Sohn keine wirkliche Motivation zeigt, seine Leistung zu verbessern. Die internal variable Attribution der Lehrerin hingegen könnte dem Schüler als Anreiz dienen.",0
        -> Selbstattribution von Michael ,0
Vielleicht hat er aber Lernprobleme oder sowas.,0
"Eine neue Idee zu diesem Fall ist, dass er den Anschein erweckt, als würde er seine Zuversicht dem nächsten Schuljahr gegenüber allerdings mehr dem Zufall zuzuschreiben als seiner eigenen Fähigkeit und Arbeitsbereitschaft. Somit bezieht er seinen Erfolg auf eine externale und variable Attribution statt auf eine internale variable, was im Sinne der Leistungsfähigkeit kontraproduktiv ist.",1
"Du hast gerade geschrieben, dass er sich wahrscheinlich nicht so viel Mühe gibt, weil er schon denkt, dass es an seinem fehlenden Talent liegt. Das sehe ich auch so. Ich bin der Meinung, dass er seinen Misserfolg internal variabel attribuieren sollte, damit er die Ursache für seine schlechten Noten in seiner niedrigen Anstrengungsbereitschaft sucht, sofern wir davon ausgehen, dass er sich momentan nicht so sehr anstrengt.",1
Er schreibt seine schlechten Noten,1
 external,1
Hypothese zum Fall:,0
1.Hypothese zum Fall:,0
- IST DIE LOKALITÄT DER ATTRIBUTION INTERNAL ODER EXTERNAL?,0
Dem stimme ich zu.,0
"Michaels Problem ist, dass er seine schlechte Mathe-Leistung internal-stabil attribuiert und auf mangelnde Begabung zurückführt. dies ist beeinflusst durch die internal-stabile Attribution seiner Eltern , die meinen, dass die gesamte Famiie vn Natur aus schlecht in Mathe sei. Zudem hat seine Lehrerin eine internal-variable Attribution und hält Michael für faul, was ebenfalls zu seiner schlechten Motivation beiträgt, da es besser wäre ihm eine external-Variable Ursache für seinen Misserfolg zu vermitteln.",1
 da er ja selbst keine Begabung für Mathe hat.,0
Perfekt!,0
 dafür verantwortlich ist.,1
"Vielleicht stellt Frau WEber auch sehr schwierige/anspruchsvolle Aufgaben, die auf mathemat. Verständnis beruhen und nicht auf Reproduktion des Stoffes.",0
 Zufall half beim bestehen:,1
"Die Hauptperson hat bedenken, nächstes Jahr nochmal Mathe zu bestehen, denkt also nicht, dass sich die Schwierigkeit leicht bewältigen lässt",1
"In meinen Augen attribuieren sie seine Erfolge eher internal, nämlich eben auf seine Fähigkeiten. Und ich stimme dir zu, eine Attribution auf variable Faktoren wäre hier bei Misserfolgen sinnvoller.",1
Ihr habt noch 10 Minuten Zeit bis zum Ende der Kollaborationsphase.,0
"Wir glauben, dass Michael seine schlechten Leistungen aktuell internal stabil attribuiert und dass er daher nicht motiviert ist, sich anzustrengen, um bessere Leistungen zu erreichen. Wir erachten ein Reattributionstraining sowohl für ihn als auch für seine Eltern als wichtig, um Michael zu einer internal variablen Attribution zu führen, sowohl für Erfolg als auch für Misserfolg.",1
evtl. kann ein Gespräch mit einem Berater weiterhelfen.,0
Belege und Begründungen:,0
"Michael scheint seine Misserfolge in Mathe internal und stabil zu attribuieren. Er sieht seine Fähigkeiten in Mathe als Ursache für seine schlechten Leistungen. Diese Selbstattribution wird gestützt von der Fremdattribution seiner Eltern, die auch seine Fähigkeiten als Ursache sehen. Die Fremdattribution seiner Lehrerin sieht anders aus, sie attribuiert seine schlechten Leistungen internal und variabel, nämlich auf seine (fehlende) Anstrengung. Mit seiner bisherigen Selbstattribution wird Michael sich kaum aus seiner Situation lösen können, da er sie als gegeben und nicht veränderbar ansieht. Eine höhere Anstrengung seinerseits ist somit auch nicht zu erwarten. Das Attributionsmuster seiner Lehrerin würde ihm zugute kommen, da er dann überhaupt erst eine Möglichkeit sieht, etwas zu verändern. Dieses Muster sollte daher Michael selbst und zudem auch seinen Eltern nahegebracht werden, damit der Wandel in der Attribution nicht nur aus Michael selbst kommt, sondern auch von seinen Eltern unterstützt wird.",1
Peters Problem: Er schreibt schlechte Noten in Mathe und denkt er könne nichts daran ändern. Peter schreibt seine schlechten Noten hauptsächlich einer nicht vorhandenen Begabung in Mathe zu. Er erwartet das nächste Schuljahr nur knapp oder nicht zu meistern.,1
 external,1
" Er hofft auf sein Glück und läßt das neue Schuljahr auf sich zukommen, ohne irgendwelche Maßnahmen zu ergreifen.",1
es gehen mißerfolge voraus,1
"Er sollte seine Leistung also eher internal variable attribuieren, damit er sich verbessern kann.",1
Diese ungünstigen Voraussetzungen,1
 external,1
"Es kann auch an seiner schlechten Begabung, zu wenig Anstrengung liegen und die Demotivation der Eltern",0
variabel-->Lehrerin,0
" Er macht seinen Mißerfolg daran fest, dass er nicht begabt genug sei.",1
" Frau Weber versucht ihm klarzumachen, dass seine Misserfolge",1
"Und die in Michaels Augen ""gute Reaktion"" der Eltern bestärkt ihn ja eigentlich nur in seiner Ansicht.",0
