message,epi
"Du hast gerade etwas gesagt, dem ich zustimme, und zwar, dass sich die Motivation und Leistung des Schülers noch ins negative weiterentwickeln. Ich denke, dass ihm hier eigene Attribuierungen fehlen und er daran arbeiten muss, um aus dem ""Mathetief"" etwas herauszukommen. Ja, die Lehrperson hingegen äußert die einzigen Atttributionen, die eine Verbesserung ermöglichen. Sie sollte ihm das jedoch auch tatsächlich zutrauen und nicht schon demotivieren.",0
" und ihm klarmachen, dass er durch eigenes Handeln und Können (sowohl internal satbil als auch variabel) seine Noten ganz allein verbessern kann.",0
Belege und Begründungen:,0
"Bitte denkt daran, das Tool für die Halbsätze zu nutzen.",0
die Selbstattribution Michaels günstig zu gestalten.,1
"Se ist doch auch möglich,daß er nicht genug viel gelernt hat oder sich bei der Klausur nicht genug angestrenngt hat.",0
"Bin ich auch der Meinung, nur wie die ""Motivation"" in dem Beispiel ist wird sie wohl nicht viel Sinn machen. ",0
Es wäre gut wenn Michael sich der Attribuierung seiner Lehrerin anschließen könnte,1
 Die Lehrerin schiebt sein Versagen auf Faulheit (internal,1
den misserfolg ,0
stabile Attribution  wird überwiegen.,0
auch seine Eltern hatten das selbe problem,0
Also von sich selbst das Können/ Begabung; von den Eltern die Begabung und von der Lehrperson die Faulheit?,1
"Ja, sie sagt es ihm beim ersten Gespräch. Dann kommen seine Eltern, die führen es auf die mangelnde Mathematikbegabung in der Familie zurück. Damit da s aber für Michael nicht zur Ausrede für mangelnde Anstrengung beim Lernen wird, steuert die Lehrerin dagegen (das ist ganz unabhängig davon, was zutrifft).",1
"Aussenseiter können,oft die Situation besser einschätzen",0
"Ein wichtiges Konzept, was man dabei beachten sollte, ist dass der Lehrer das Selbstkonzept von Michael noch  mehr verschlechtert, indem sie das Problem als ""himmelschreiende Faulheit"" beschreibt. Dies ist ein internal stabile Attribution.",1
Ich dachte wir hätten es damit beschrieben,0
"Ich würde sagen, es handelt sich also um zwei konkurierende fremdattributionen. es kommt darauf an, welche ihn eher beeinflusst. in dem alter gibt man ja sowieso nicht viel auf das was einem autoritäre personen sagen. aber da die eltern ihm ja quasi zustimmen unter dem motto ""ist schon nicht schlimm, du kannst es halt nicht besser"", sehe ich keine guten chancen für ihn, sich tatsächlich zu verbessern",1
Belege und Begründungen:,0
" sie meint, seine Matheschwäche wäre  das Resultat von Faulheit, also ein Beispiel für",1
"ich glaub,wir sollen unabhängig der 3 Fällen die Aufgaben bearbeiten",0
1. Lehrerin:,1
Auch der Vater begründet die geschaffte Abiturprüfung nur den Umständen durch Spicker etc.,0
Ja okay stimmt,0
"Nicht unbedingt die bessere Note, sondern vielleicht erst einmaleine Verbesserung der Punktezahl, die ihn motiviert.",0
"Du hast gerade geschrieben, dass es internal ist. Da bin ich mir nicht sicher. Es kommt darauf an, warum er denkt, dass Mathe einfach nicht sein Fach ist. Wenn er denkt, dass es an seinen eigenen Fähigkeiten liegt ist es internal. Wenn er aber einfach davon ausgeht, dass er nichts dafür kann, weil es ""einfach nicht sein Fach ist"" wäre es external.",0
attribution- und er solle sich einfach mehr anstrengen.,1
"varierenden a.,",1
"Du hast gerade etwas gesagt, dem ich (nicht) zustimme, und zwar, dass die Attribuierung der Eltern die Selbstattribuierung des Schülers bestärkt. Ich denke die Fremdattribution der Lehrerin ist in Ordnung, da sie darauf aufmerksam macht, dass Anstrengung notwendig ist um Mathe zu bestehen, aber nicht besonders hilfreich, die Attribution der Eltern (der mangelnden Begabung für Mathe) zu widerlegen.",1
(internal ,1
"Was Frau Weber die Lehrerin, meint ist dass es internal variabel ist, weil es etwas mit der Anstrengung zu tun hat.",1
"Ich denke wir sollten mit Michaels Selbsattribution anfangen und dann zu den Fremdattributionen der Eltern und der Lehrerin übergehen. Ich denke, dass Michael Internal stabil attribuiert, dass er unbegabt in Mathe ist- was denkst du?",1
"Also könnte man sagen das einerseits die Eltern die Selbstattribution des Schülers negativ beeinflussen, indem sie seinen Misserfolg auf die allgemeinen schlechten Mathekenntnisse der Familie zurückführen und somit eben auf eine internale/stabile ""Eigenschaft"". Dies vermittelt dem Schüler eine Sinnlosigkeit in seinem Handeln beziehungsweise in dem Versuch, etwas an der Situation zu ändern. Bezüglich der Lehrkraft bin ich eben der Meinung das trotz der eher strengen Wortwahl, diese versucht dem Schüler aufzuzeigen, dass dieser etwas an seinem Handeln ändern kann",1
"sollen wir alle am gleichen fall,oder jeder an einem anderen fall arbeiten?",0
Jetzt können wir noch das Verhalten der Lehrerin und der Eltern beurteilen. ,0
"Du hast gerade etwas gesagt, dem ich zustimme, und zwar, dass die Anstrengung des Schülers internal variabel ist.",1
indem sie seinen Misserfolg auf fehlende Anstrengung attribuiert (variabel),1
(intern,1
1.Hypothese zum Fall:,0
Fremdattributation der Lehrerin ,1
variable Attribution zurückführt .,1
"aufgrund der auf ihn einwirkenden Fremdattribution,",1
Michael sollte seinen Misserfolg,0
"Michael sagt selber, dass Mathe einfach nicht sein Fach ist , also zweifelt er an seinen mathematischen Fähigkeiten",0
sondern faulheit liegt.,1
"Auf der Ebene der Attributionstheorie,wird,dass hier als eine internale ",0
sie erzeugt damit eine internal ,1
 und zum anderen an der Fremdattributation deiner Eltern.,0
Sie begründet seine Noten durch Faulheit,1
"Die Schwierigkeit der Hauptperson besteht darin, dass sie schlechte Noten in Mathe hat und anfängt zu glauben, sie habe einfach keine Begabung für dieses Fach (Selbstattribution). Das Ganze wird durch die Fremdattribution der Lehrerin (die ihm sagt, er müsse sich ziemlich anstrengen um die 9. zu schaffen) und der eigenen Eltern gefördert, die die mangelnde Leistung in Mathe damit entschuldigen, dass sie ganze Familie schon immer schlecht in Mathe gewesen sei.",1
"Durch die Fremdattribution der Lehrerin hat er das Jahr geschafft und gemerkt, dass seine Leistungen variabel sind",0
"Seine Eltern boten ihm da die perfekte ""Ausrede"" und habe somit seine Motivation und Leistungsbereitschaft verschlechtert. Er glaubt nicht, dass er auch besser sein könnte.",0
internal,1
internal,0
1.)die fremdatributonen:a)die der lehrerin:,1
Aber natürlich könnte er sich auch durch die Fremdattribution durch die Lehrerin ,1
"Ein wichtiges Konzept, was man dabei beachten sollte, ist, dass die Mathelehrerin Frau Peters (Fremdattribution) Michael nahelegt, sich anzustrengen und mehr zu lernen, um die Prüfungen zu schaffen (internaler, variabler Faktor). Sie macht es also weniger von seiner Begabung, sondern von seiner eigenen Anstrengung abhängung.",1
Lehrerin attribuiert günstig.,1
"a) in der neunten klasse:war positiv attributiert von seiner lehrerin, da sie gesagt er müsse sich anstrengen um die klasse zu schaffen, er hat sie dann auch geschafft.(",1
" Die Lehrerin hat insofern Recht, dass sie seine Geschichte als Ausrede abtut, ob es auf diese Art natürlich pädagogisch richtig ist, dass ist eine andere Frage",1
PROGNOSE UND PÄDAGOGISCHE KONSEQUENZEN AUS DER PERSPEKTIVE DER ATTRIBUTIONSTHEORIE:,0
"Eine neue Idee zu diesem Fall ist, dass die Lehrerin den Misserfolg des Schülers allerdings internal variabel attribuiert, indem sie ihm sagt, es müsse sich mehr anstrengen. Eine variable Attribution bei Misserfolg ist an sich günstig für weitere Motivation",1
variable atribution.,1
WEIL FOLGENDE FALLINFORMATION DAFÜR SPRICHT:,0
"Ich denke,dass wir mit dem 1. Teil und der Aufzählung der Aspekte schon alles haben.",0
"könnte auch variabel sein, weil die lehrerin am schluss bemerkt, dass es sich bei ihm anscheinend um faulheit handelt",1
"Michael scheint seine Misserfolge in Mathe internal und stabil zu attribuieren. Er sieht seine Fähigkeiten in Mathe als Ursache für seine schlechten Leistungen. Diese Selbstattribution wird gestützt von der Fremdattribution seiner Eltern, die auch seine Fähigkeiten als Ursache sehen. Die Fremdattribution seiner Lehrerin sieht anders aus, sie attribuiert seine schlechten Leistungen internal und variabel, nämlich auf seine (fehlende) Anstrengung. Mit seiner bisherigen Selbstattribution wird Michael sich kaum aus seiner Situation lösen können, da er sie als gegeben und nicht veränderbar ansieht. Eine höhere Anstrengung seinerseits ist somit auch nicht zu erwarten. Das Attributionsmuster seiner Lehrerin würde ihm zugute kommen, da er dann überhaupt erst eine Möglichkeit sieht, etwas zu verändern. Dieses Muster sollte daher Michael selbst und zudem auch seinen Eltern nahegebracht werden, damit der Wandel in der Attribution nicht nur aus Michael selbst kommt, sondern auch von seinen Eltern unterstützt wird.",1
"Ein wichtiges Konzept, was man dabei beachten sollte, ist, dass die Mathelehrerin Frau Peters (Fremdattribution) Michael nahelegt, sich anzustrengen und mehr zu lernen, um die Prüfungen zu schaffen (internaler, variabler Faktor). Sie macht es also weniger von seiner Begabung, sondern von seiner eigenen Anstrengung abhängung.",1
WEIL FOLGENDE FALLINFORMATION DAFÜR SPRICHT:,0
Belege und Begründungen:,0
 das eigene Denken beeinflussen können.,1
 Fremdattributionen lernt er keine mathematischen Formeln auswendig.,1
variable also anstrengungzurück.,1
"Du hast gerade geschrieben, dass Michael noch keine positiven Erfolge hatte. Dies halte ich für einen sehr intelligenten Gedanken.",0
 =    internal,1
Ja!,0
 zielt auf den internal,1
"Genau, die Anstrengung wäre ja einmal internal variabel und die Begabung internal stabil",1
"Ein wichtiges Konzept, was man dabei beachten sollte, ist dass die Lehrerin dabei wenigstens variabel argumentiert und sowohl im Gespräch mit dem Vater, als auch mit Michael die Matheleistung internal variabel - also wenigstens als veränderbar- attribuiert. Aber ansonsten gebe ich dir vollkommen Recht, dass ein Gespräch, so wie du es vorgeschlagen hast, deutlich besser für die Motivation des Kindes gewesen wäre",1
"könnte auch variabel sein, weil die lehrerin am schluss bemerkt, dass es sich bei ihm anscheinend um faulheit handelt",1
variabel,0
"Du hast gerade etwas gesagt, dem ich zustimme, und zwar dass die Eltern als Fremdattributoren eine besondere Rolle einnhemen und Vorbildcharakter haben. Wenn sie internale stabile verantwortlich machen und diese gleichzeitig normalisieren ist das prägend.",0
FÜR DIESEN FALL RELEVANTE BEGRIFFE DER ATTRIBUTIONSTHEORIE:- GEHT DER ATTRIBUTION EIN ERFOLG ODER EIN MISSERFOLG VORAUS?,0
Top!,0
"Was Frau Weber die Lehrerin, meint ist dass es internal variabel ist, weil es etwas mit der Anstrengung zu tun hat.",1
"Du hast gerade etwas gesagt, dem ich zustimme, und zwar wenn er sich Hilfe nehmen würde von außerhalb könnte er seine Leistungen verbessern. Sein Erfolg wäre dann aber sowohl external weil die äußeren Bedingungen ihm dies ermöglicht haben, sowohl als auch internal, weil er sich ja selbst dann auch mehr anstrengt.",0
1.Hypothese zum Fall:,0
mit Faulheit ,1
Wir müssen hier glaub ich zwei Dinge unterscheiden:,0
"Ja, sehr schön. Ich würde vllt noch den letzten Satz des Textes so interpretieren, dass sie Hauptperson trotz der Fremdattribution von Frau Weber nicht optimistisch in die Zukunft schaut.",1
Zu viel Positives VErhalten kann auch fehlleiten.,0
Der Grund für seine schlechten Noten würde dann in der mangelnden Anstrengung liegen,0
"Michaels Eltern sollten aufhören ihrem Sohn mangelnde Begabung zu unterstellen, sondern ihn zu mehr Anstrengung ermuntern.",0
Seid ihr beide da?,0
"Okay, dann übernehme ich das :) und du kannst dann gerne ggf. Dinge ergänzen oder verbessern, sollen wir das so machen?",0
"Daß heißt wir haben:Fau Weber, deren Fremdattribution",1
"Eine neue Idee zu diesem Fall ist außerdem, dass die Lehrerin ein schriftliches Feedback zur Leistung des Schülers geben könnte, statt den Misserfolg ausschließlich auf seine Anstrengung, also auf einen internal variablen Faktor, zu beziehen",1
 das eigene Denken beeinflussen können.,1
"a) in der neunten klasse:war positiv attributiert von seiner lehrerin, da sie gesagt er müsse sich anstrengen um die klasse zu schaffen, er hat sie dann auch geschafft.(",1
"Dadurch das die Lehrerin selber an ""Faulheit"" glaubt, also eine Lokalität die zwar innerhalb der Person ist, ",1
Keine besonders guten Leistungen,0
mit Faulheit ,1
"Darüber hinaus ist das Verhalten bzw. die Reaktion der Lehrkraft auch nicht zielführend, da sie der Ausrede teilweise zustimmt. Trotzdem weist sie den Schüler daraufhin, dass er die Ursache in der Faulheit suchen soll",1
"Information aus dem Fall, die wir noch nicht betrachtet haben, ist dass die Lehrkraft seinen Misserfolg auf seinen geringen Fleiß (internal variabel) attribuiert.  An sich, ist das ein Merkmal, welches von dem Schüler beeinflussbar ist. Möglicherweise könnte die Lehrkraft durch andere Formulierungen den Schüler davon überzeugen, dass er durch anstrenung bessere Noten erzielt und somit ein gesünderes Attributionsmuster entwickelt.",1
attribution- und er solle sich einfach mehr anstrengen.,1
1.Hypothese zum Fall:,0
internal,1
Belege und Begründungen:,0
Das Michael seine Misserfolge in Mathe internal,0
"Die Lehrerin wiederum meint, Michael sei schlichtweg faul und solle sich mehr anstrengen. ",1
Wnn ich meinen Erfolg aber auf Zufall zurückführe könnte das zu Selbstbewustseinsmangel führen ( vgl. Ingrig mit dem Abitur durch Glück ),0
"variabel),",1
"Danke! Ihr könnt den Chat jetzt über den ""Chat Beenden""-Button schließen.",0
"Es sind definitiv mehrere Einflusspersonen im Spiel. Die Lehrerin fordert den S zwar, die Attribution auf die mangelnde Bemühung zurückzuführen. Andererseits bestätigt sie die Attribution auf die Begabung, so wie du gesagt hast. Ich finde deinen Vorschlag gut, dass die Lehrerin ihn deutlicher ermutigen sollte sich mehr zu bemühen oder ihm auch sagen, dass die Denke seiner Familie diesbezüglich keinen Sinn ergibt und ihn nicht fordert.",1
"Bin ich auch der Meinung, ",0
wie schließt man andrer einflussfaktoren denn bitte aus,0
"Eine neue Idee zu diesem Fall ist, dass zumindest die Lehrerin davon ausgeht, dass es eher an der Anstrengung liegt (Ausreden für Faulheit)",0
bestärken lassen,1
"Es sind definitiv mehrere Einflusspersonen im Spiel. Die Lehrerin fordert den S zwar, die Attribution auf die mangelnde Bemühung zurückzuführen. Andererseits bestätigt sie die Attribution auf die Begabung, so wie du gesagt hast. Ich finde deinen Vorschlag gut, dass die Lehrerin ihn deutlicher ermutigen sollte sich mehr zu bemühen oder ihm auch sagen, dass die Denke seiner Familie diesbezüglich keinen Sinn ergibt und ihn nicht fordert.",1
"Eine neue Idee zu diesem Fall ist, dass Michaels Lehrerin versucht, Michael zu motivieren, indem sie ihn dazu bringen möchte, dass er seinen mangelnden Erfolg auf zu wenig Anstrengung zurückführt.",1
Der Schüler macht seine mangelnde Begabung für seinen Misserfolg verantwortlich,0
1.Hypothese zum Fall:,0
"Also zur Zusammenfassung der Punkte auf die wir uns geeinigt haben. Die Eltern haben Michael in seiner Meinung, dass er unbegabt ist bestärkt und das führt zu einer Schwächung der Motivation. Frau Weber hat ihn, wenn auch nicht perfekt, darauf hingewiesen, dass er sich mehr anstrengen muss, wenn er nächstes Jahr bestehen will. Dies kann zu einer Steigerung der Motivation führen und zu einem wegleiten der von Michael verwendeten Begründung, dass er unbegabt sei.",1
" variable Attribution, die durch mehr Lernen und Anstrengung auch veränderbar ist, und Michael sehr wohl zu besseren Leistungen im Stande ist.",1
"Information aus dem Fall, die wir noch nicht betrachtet haben, ist , dass der Schüler nicht nur durch die Aussagen der Eltern beeinflusst wird, sondern auch durch die Aussage der Lehrerin, die meint, der Schüler sei faul",1
sie führt es auf die faulheit,1
"Michael Peters ist ein Schüler mit Schwierigkeiten im Fach Mathe, die er zunehmend stabil-internal attribuiert (mangelnde Fähigkeit). Beeinflusst wird seine Selbstattribution dabei durch die stabil-internalen Fremdattributionen seiner Eltern (mangelnde Fähigkeit liegt in der Familie) und die variabel-externale Fremdattribution seiner Mathelehrerin (er strenge sich nicht genügend an). Beide Fremdattributionen beeinflussen nach der Attributionstheorie sein Lern- und Leistungsverhalten - schwächen und stärken also Michaels Glauben, mit der Situation umgehen zu können.",1
Die Fremdattribution seiner Eltern wirkt bestätigend auf seine Selbstattribution.,1
"Die Lehrerin wirkt positiv auf ihn ein, obwohl es anscheinend keinen Einfluss auf ihn hat, da er ja Mathe ja trotzdem nicht mag.",1
"Denkst du, dass er mit seinen Schwierigkeiten fertig wird?",0
variable Fremdattribution),1
"Er sagt selbst er sei schlecht in Mathe und seine Lehrerin sagt ihm ja auch, dass er sich ziemlich anstrengen müsse um die Klasse zu schaffen. Zählt das dann zu Fremdattributierung?",1
"Wobei die Unsicherheit eher dadurch verstärkt wird, dass der Vater auch stabil-internal fremdattribuiert (Familie als Schrecken der Mathelererin). Ein wichtiges Konzept, was man insgesamt beachten sollte, sind die gegensätzlichen Fremdattributionen von Familie und Mathelererin, die nach Z71 Michael Peters beeinflussen",1
" variablen attribution ist ungenügend,",1
"wird so ein Kind sich später selbst motivieren,selbst kontollieren können und selber die Ursachen des eventuelen Mißerfolgs rausfinden(oder sich selbs dazu bekennen...das es z.B. nicht nur die Sache der fehlenden Begabung ist).",0
"wenn michael diese sichtweise übernimmt wäre esfür ihn wesentlich vorteilhafter,da jeder eineneinfluss auf seine eigene anstrengung hat ",1
Relativierungen des Arguments:,0
FOLGENDE PUNKTE SIND UNGENAU DARGESTELLT:,0
" Seine ""Versagen"" leigt in der Selbstatributtation,",0
"Daß heißt wir haben:Fau Weber, deren Fremdattribution",1
"Die Erklärung: Michael Peters wird in diesem Szenario sowohl von Fremdattributionen, als auch von seinen internen Attributionen beeinflusst. Er selbst redet sich ein, dass er Mathe nicht kann. Dadurch sucht er natürlich nach Möglichkeiten, seine schlechten Ergebnisse zu erklären. Seine Eltern geben ihm den Asnatz zu glauben, dass ihm die nötige Begabung dazu fehle.",1
ein reattributionstraining durch Eltern und Schüler könnte ihm helfen,0
FOLGENDE PUNKTE SIND UNGENAU DARGESTELLT:,0
Da laut 76. ungünstige fremdattributionen verhindert werden sollen?,0
WEIL FOLGENDE FALLINFORMATION DAFÜR SPRICHT:,0
" hat -du siehst nur, dass sie stattfindet",1
"Du hast gerade geschrieben, dass du mir bei dem Punkt der Faulheit nicht zustimmst, dass kann ich verstehen, aber ich würde es in diesem Kontext eher als stabiles Persönlichkeitsmerkmal interpretieren. Trotzdem ist diese Fremdattribution der Lehrerin nicht hilfreich und ich denke es wäre besser, wenn sie den Begriff Faulheit durch Anstrengung ersetzen würde.",1
1.Hypothese zum Fall:,0
Dachte mal das könnte mangelnde Begabung bedeuten,0
"Falls er erneut versagen sollte, wäre es besser das dem eigenen Lernaufwand zuzuschreiben, denn das kann er ändern.",0
Ihr habt noch 10 Minuten Zeit bis zum Ende der Kollaborationsphase.,0
"der Schüler glaubt aufgrund seiner fehlenden Begabung, Mathe nie zu können.",0
sie bestärkt ihn somit einfach mehr zu lernen und dass es in seiner hand liegt,1
1.Hypothese zum Fall:,0
"Bevor wir anfangen, könnt ihr mir bestätigen, dass das Halbsätze-Tool bei euch richtig funktioniert? Bitte wählt dazu einen Halbsatz aus und postet ihn in den Chat.",0
" sie meint, seine Matheschwäche wäre das Resultat von Faulheit,",1
"Ich denke wir sollten mit Michaels Selbsattribution anfangen und dann zu den Fremdattributionen der Eltern und der Lehrerin übergehen. Ich denke, dass Michael Internal stabil attribuiert, dass er unbegabt in Mathe ist- was denkst du?",1
"Ein wichtiges Konzept, was man dabei beachten sollte, ist dass der Lehrer das Selbstkonzept von Michael noch  mehr verschlechtert, indem sie das Problem als ""himmelschreiende Faulheit"" beschreibt. Dies ist ein internal stabile Attribution.",1
variable Fremdattribution),1
"Durch seine Eltern, lässt ersich nur noch bestätigen.",0
1.)die fremdatributonen:a)die der lehrerin:,1
"Du hast gerade etwas gesagt, dem ich zustimme, und zwar dass die Reaktion der Lehrerin eine internale variable Attribution zur Folge hat. Somit müsste man aber an zwei Baustellen reagieren. EInserseits müssten die Eltern ihre Position aufweichen und das Kind ermutigen, mehr Energie hineinzustecken, um zu sehen ob sich etwas ändert und andererseits wäre damit der Forderung der Lehrkraft folge geleistet.",1
sie zeigt ihm praktisch die externale,0
"Eine neue Idee zu diesem Fall ist, dass die Lehrerin ihn im Grunde nicht demotiviert, weil er genetisch bedingt kein Mathe könne, sondern sie es als Ausrede betitelt, womit dies auch positiv auf ihn wirken könnte.",1
"Mit Faul meine ich, dass ihm (weder durch ihn selbst, noch von den Eltern) nicht nahegelegt wird, etwas gegen das Problem zu tun",0
Hallo :) sorry ich hab mir grad schon den Fall durchgelesen,0
variable Attribution,1
"Du hast gerade etwas gesagt, dem ich zustimme, und zwar, dass die Anstrengung des Schülers internal variabel ist.",1
"Grundlegende Schwierigkeit des Schülers ist die mangelnde Leistung im Fach Mathematik und der Unwissenheit, wie er damit umzugehen hat. Einfluss auf die Situation nehmen einerseits die Eltern welche das ganze als mehr oder weniger angeborene Eigenschaft abtun und dieses somit auf eine internal/stabile Ebene beziehen. Hiermit vermitteln sie dem Schüler ein Bild der Ausweglosigkeit und der daraus resultierend Unveränderbarkeit in seiner Situation. Andererseits vertritt die Lehrkraft eher die Ansicht, dass diese Schwierigkeit eher internal/variabel ist und eröffnet dem Schüler somit die Ansicht, dass er durchaus etwas an seinem Verhalten ändern kann. Bei letzterem Schritt lässt sich allerdings diskutieren, inwiefern die Vorgehensweise der Lehrkraft optimal gewählt ist.",1
Ja,0
"a) in der neunten klasse:war positiv attributiert von seiner lehrerin, da sie gesagt er müsse sich anstrengen um die klasse zu schaffen, er hat sie dann auch geschafft.(",1
"seine eltern haben sich selber nie angestrengd, weshalb michael mit ein bischen fleiss wahrscheinlich viel erreichen kann",0
"Da stimme ich dir zu, die Fremattributionen tragen zu diesem ungünstigen Attributionsmuster bei",1
Also zur Zusammenfassung: Selbstattribution --> internal stabile Attribution und Frau Weber: external/internal stabile Attribution,1
"Die Schwierigkeit der Hauptperson besteht darin, dass sie schlechte Noten in Mathe hat und anfängt zu glauben, sie habe einfach keine Begabung für dieses Fach (Selbstattribution). Das Ganze wird durch die Fremdattribution der Lehrerin (die ihm sagt, er müsse sich ziemlich anstrengen um die 9. zu schaffen) und der eigenen Eltern gefördert, die die mangelnde Leistung in Mathe damit entschuldigen, dass sie ganze Familie schon immer schlecht in Mathe gewesen sei.",1
 Fremdattributionen lernt er keine mathematischen Formeln auswendig.,1
"Und es wird nur internal stabil begründet, was es so aussehen lässt als sein an der Situation nichts zu ändern",0
"Der Grund für seine Mißerfolge können variable Ursachen sein, eher Zufall dass er so schlecht ist.",0
(Fremdattr. ),1
aber jeder kann mathe lernen,0
"Wobei die Unsicherheit eher dadurch verstärkt wird, dass der Vater auch stabil-internal fremdattribuiert (Familie als Schrecken der Mathelererin). Ein wichtiges Konzept, was man insgesamt beachten sollte, sind die gegensätzlichen Fremdattributionen von Familie und Mathelererin, die nach Z71 Michael Peters beeinflussen",1
"Michaels Problem ist, dass er seine schlechte Mathe-Leistung internal-stabil attribuiert und auf mangelnde Begabung zurückführt. dies ist beeinflusst durch die internal-stabile Attribution seiner Eltern , die meinen, dass die gesamte Famiie vn Natur aus schlecht in Mathe sei. Zudem hat seine Lehrerin eine internal-variable Attribution und hält Michael für faul, was ebenfalls zu seiner schlechten Motivation beiträgt, da es besser wäre ihm eine external-Variable Ursache für seinen Misserfolg zu vermitteln.",1
was einer internal ,1
"Du hast gerade geschrieben, dass du gerne mit der Fremdattribution anfangen würdest. Ich würde zunächst die Schwierigkeit der Hauptperson Michael definieren",0
denn die Fremdattribution des Lehrers ,1
"Michael wird nicht gefördert, er wird sogar demotiviert!",0
die Selbstattribution Michaels günstig zu gestalten.,1
" die Begabung,",0
"Du hast gerade etwas gesagt, dem ich zustimme, und zwar dass es nur 'ein bisschen' internal ist. Die Lehrerin denkt, dass es von äußeren Bedingungen beeinflusst sein werden könnte. So wie du sagst, ein Erfolg ist nicht zu erwarten, da auch die Eltern selbst sagen, dass es einfach in der Familie liegt, und schon immer so gewesen ist (also die internale stabile Attribution) . Die Lehrerin ist nicht motivierend in dem sie sagt, dass er zu faul ist.",0
" Sie behauptet, dass die mangelnde Begabung eine Ausrede ist, und schiebt die schlechten noten auf seine Faulheit (internal",1
variable ursache,1
"Er wird v.a. von außen fremdattribuiert. Zum einen negativ von der Lehrerin, ",1
Ihr habt noch 10 Minuten Zeit bis zum Ende der Kollaborationsphase.,0
variabel:,1
- WIRD AUF EINE STABILE ODER EINE VARIABLE URSACHE ATTRIBUIERT?,0
(ich versuche noch mal gerade in der übeig gebliebenen zeit was zu schreiben,0
"Vor allem aber sollten auch die Eltern trainiert werden, damit sie ihren Sohn in Zukunft nicht mehr in seinem falschen Glauben bestärken,",0
