message,epi
"Ein wichtiges Konzept, was man dabei beachten sollte, ist durch die Fremdattribution durch die Lehrperson wird Michael quasi unter Druck gesetzt, indem gesagt wird das er sich anstrengen muss wenn er die neunte Klasse schaffen möchte.",1
"Fremdattributation der Lehrerin ist, ",1
"Einen Schüler als ""himmelschreiend faul"" zu bezeichnen ist ja wohl die größte Frechheit.",0
da sie variable Ursachen für sein Scheitern verantwortlich macht. ,1
"Du hast gesagt, dass du mir zustimmst, dass es Teil seines festen Charakters sei - damit meinte ich die Faulheit, die die Lehrerin anspricht. Und ich finde, dass sie ihm quasi einredet faul zu sein. Sie meint es vermutlich gut, weil es im Grunde dann ja eine internale unstabile Attribution ist, die man ändern kann. Aber wenn mir jemand die ganze Zeit sagen würde, dass ich Faul bin, dann werde ich das vielleicht auch. Ich meine einfach, dass sie es anders formulieren könnte, wie beispielsweise ""Ich weiß, dass du es schaffen kannst, wenn du dich mehr anstrenst."" anstatt zu sagen, ""Wenn du nicht so faul wärst, wärst du gut genug."" (So kommen ihre Worte zumindest bei mir an)",1
Hallo an Birke und Pinie,0
Gehe mal die Ideen von oben nach unten durch,0
internal,0
"Hallo, willkommen in der Chatumgebung.  Seid ihr beide da?",0
 und wir durch Fremdattribution der Eltern darin bestärkt.,0
"Michaels Eltern waren scheinbar selbst schon nicht gut in Mathe. Schon bei Ihnen scheint eine Attribution auf internal stabile Faktoren, wie die Begabung, entfallen zu sein. Demensprechend stülpen sie ihrem Sohn Michael bei schlechten Zensuren in Mathe die selbe Fremdattribution über. Michael scheint daher selbst auch zu glauben, er sei einfach nicht begabt. Dies ist der Fall, obwohl seine Lehrerin ihm anfangs sagte, er müsse sich mehr anstrengen. Bei der Anstrengung handelt es sich um eine internal variable Attribution. Diese Aussage seiner Mathe Lehrerin erzählt Michael seinen Eltern nicht.  Der Lehrerin erzählt er im Nachgang allerdings wohl von dem Gespräch mit den Eltern. Diese reagiert darauf fast schon trotzig und bezeichnet die Fremdattribution auf die Begabung als Ausrede für Faulheit. Damit verbessert sie wiederum die Situation auch nicht. Besser wäre es gewesen, sie hätte Michael ernsthaft darüber aufgeklärt, dass es in seiner Hand liegt, wie sehr er sich anstrengt und übt. Michael war jedoch angetüdelt, sodass fraglich ist, wie viel sowas in dem Zustand gebracht hätte.",1
Frau Weber führt seine Leistungen auf mangelnde Anstrengung zurück ,1
Die Lehrerein denkt er ist zu faul --> intern weil das ja seine Schuld ist,1
 Fremdattributionen lernt er keine mathematischen Formeln auswendig.,1
"Du hast gerade geschrieben, dass du die faulhiet nicht richtig einordnen kannst. ich würde sagen, dass wäre dann eine internale aber variable attribution, oder?",1
"Ja, aber eine positive, die Motivationssteigern wirken soll. Die Fremdattribution der Eltern ist nach der Attributionstheorie ungünstig, da sie den Misserfolg auf internale, stabile Faktoren (Begabung) lenkt",1
"Zusammenfassung: Michael glaubt er sei mathematisch unbegabt (internal stabiles Attributionsmuster). Seine Eltern bestärken ihn in seiner Überzeugung. Sie glaube es liebe in ihren Genen schlecht in Mathe zu sein (internal stabil). Der Vater ist allerdings der Meinung man könne dennoch Einfluss auf die Ergebnisse in Matheprüfungen nehmen, indem man sich unerlaubten Mitteln bedient, wie Spicken oder Abschreiben (internal variabel). Die Lehrerin ist die einzige Person, die der Überzeugung ist, der junge könne durch Anstrengung (internal stabil)seine Leistung verbessern, allerdings nimmt die Fremdattribution der Eltern wesentlich größeren Einfluss auf den Jungen, wahrscheinlich, weil es der bequemere Erklärungsansatz ist. Unser Meinung nach bestünde ncoh eine Chance der Besserung, wenn die Eltern ihren Sohn mehr mental unterstützen.",1
"Du hast gerade in der vorherigen Nachicht etwas gesagt, dem ich (nicht) zustimme, und zwar glaube ich dass die Faulheit eher eine internal variable Attribution ist und nicht external. Wie siehst du das?",1
"Michael ist schlecht in Mathe. Er ist über seine eigenen Fähigkeiten verunsichrt. Seine Lehrerin attribuiert seine Lesitugn auf seine mangelnde Anstrengung. Seine eltern attribuieren seine Leistung auf die generelle familliäre unfähigkeit im Bereich mathematik. Um sich klarer zu werden, ob er das nächste Schuljahr schaffen kann, auf das er ""gespannt"" ist, trotz der aktuellen schlechten Leistungen in Mathe, geht er auf eine neutrale außenstehende Person, den Schulpsychologen, zu.",1
"Eine einfache Fremdmotivation seiner Lehrerin, hat ihm gezeigt, dass es nicht nur auf die Begabung, ",1
"Internal variable Attribution.Je mehr man sich anstrengt, dest weniger faul ist man. Man kann den Zustand also verändern.",0
"Sein Vater erzählt ihm wohl um ihn aufzumuntern die Geschichte,",0
"Außerdem fehlte es ihm an Unterstützung der Eltern, da die die Bereitschaft zur Hilfe garnicht erst hatten.",0
"zeigt sie, das sie nicht denkt, das Michael dumm ist, sondern wenn er lernen würde, könnte er Mathe gut schaffen.",1
um was gehts?,0
"die lehrerin:sagt er ist faul, ",1
"Information aus dem Fall, die wir noch nicht betrachtet haben, ist, dass es eine schlechte Idee des Vaters ist, seinem Sohn zu erzählen, dass er damals nur durch Schummeln bestanden hat, da das dem Sohn eine falsche Idee gibt und seine Leistungsmotivation sich anzustrengen noch mehr verringert, da er sich wahrscheinlich denken wird, dass er es dann auch durch Schummeln regeln wird.",0
"Interessant is auch, wie du schon gesagt hast, wie Fremdattribution in diesem Fall von statten geht. Die Eltern attribuieren seine Probleme durch internal-stabile Faktoren, wie der Begabung. Ich würde eventuell sogar soweit gehen zu sagen, seine Eltern sehen dies als genetische Veranlagung. Die Lehrerin allerdings versucht, Michael dahin zu bewegen, dass er seine schlechte Leistung in Mathematik internal-variabel seiner Anstrengung zuschreibt. Laut 52 ist es ja günstig, Misserfolge auf variable Ursachen wie Anstrengung zurückzuführen.",1
damit er von internal stabil zu internal variabel wechselt,1
stabile attribution handeln,0
Die negative Fremdattribution der Mathelehrerin,1
 haben:,1
"Ein wichtiges Konzept, was man dabei beachten sollte, ist, dass wie du richtig angemerkt hast, die Mathelehrerin wohl ein voreingenommenes Bild hat und Michael außerdem suggeriert, sein Misserfolg liegt an ""fehlender Anstrengung"". Besser wäre es hier statt internal external zu attribuieren, da Michael so nie motiviert handeln wird. Sie hätte auch sagen können: ""Also bei der letzten Arbeit war es einfach nicht dein Tag, ich weiß, dass du dich sehr bemüht hast, aber vll können wir eine Lösung finden, wie du effektiver lernen kannst?""",1
"und im Prinzip wird er weder von der Lehrerin noch von seinen Eltern positiv beeinflusst, da die Lehrerin der Auffassung ist, dass es an Michaels Faulheit liegt und die Eltern sich einfach damit abfinden, weil sie selbst nie gut in Mathe waren",1
variable A. handelt (Faulheit),0
Fremdattribution. ,1
"Mein erster Gedanke ist, dass die Lehrerin die schlechte Matheleistung im Unterricht auf die Anstrengung vom Schüler schiebt",1
"Auf der einen Seite die Lehrerin, die die mangelnden Leistungen der Faulheit zuschreibt ,",1
"Die Lehrerin signalisiert Michael schon, dass das Problem bei ihm selbst",1
bestärken lassen,1
Durch die Demotivation seiner Eltern wird Michael nicht zu Anstrengung gefordert,0
1.Hypothese zum Fall:,0
Michaels Lehrerin macht seinen Mißerfolg an einer internal ,1
"Also : Die Selbstattribution ist internal stabil und die Attribution aus Sicht der Lehrerin external stabil, aber auch ein wenig internal stabil. Es wird kein Erfolg erwartet, da die Lehrerin njicht wirklich motivierend auf den Schüler wirkt und er auch selbst keine Besserung erwartet, da er das Problem in der Familie sieht",1
1.Hypothese zum Fall:,0
"Wenn sich an den Mustern nichts ändert, stehen die Chancen für Michael wohl schlecht. ",0
"Du hast gerade etwas gesagt, dem ich zustimme, und zwar, dass die Anstrengung des Schülers internal variabel ist.",1
da sie variable Ursachen für sein Scheitern verantwortlich macht. ,1
 und davon aussgeht er sei faul,1
"es kann ein Ansporn sein.Michael könnte versuchen,genau aufgrund dieser Aussage bessere Leistungen zu erzielen,um es den anderen zu beweisen",0
"variabel),",1
mit Faulheit ,1
"Liebe Versuchsleitung, die andere Person ist aus dem Chat geflogen und bräuchte erneut das Passwort",0
durch eine positive fremdattribution durch die lehrerin ,1
Ja,0
"und die lehrkraft sagt ja es wäre Faulheit, was ja variabel ist, das heißt es könnte geändert werden. würde er sich darauf konzentrieren, könnte er zu der Einsicht kommen, dass sein Misserfolg in Mathe nicht stabil ist, und er es ändern könnte",1
Hierbei handelt es sich um internal,0
" variable Attribution, die durch mehr Lernen und Anstrengung auch veränderbar ist, und Michael sehr wohl zu besseren Leistungen im Stande ist.",1
"Grundlegende Schwierigkeit des Schülers ist die mangelnde Leistung im Fach Mathematik und der Unwissenheit, wie er damit umzugehen hat. Einfluss auf die Situation nehmen einerseits die Eltern welche das ganze als mehr oder weniger angeborene Eigenschaft abtun und dieses somit auf eine internal/stabile Ebene beziehen. Hiermit vermitteln sie dem Schüler ein Bild der Ausweglosigkeit und der daraus resultierend Unveränderbarkeit in seiner Situation. Andererseits vertritt die Lehrkraft eher die Ansicht, dass diese Schwierigkeit eher internal/variabel ist und eröffnet dem Schüler somit die Ansicht, dass er durchaus etwas an seinem Verhalten ändern kann. Bei letzterem Schritt lässt sich allerdings diskutieren, inwiefern die Vorgehensweise der Lehrkraft optimal gewählt ist.",1
"Aber es ist einfach ein schwieriges Alter, ich glaub da könnte man viel erzählen und vielleicht würde er Mathe trotzdem nicht mögen.",0
"dazu kommt, dass die fremdattribution durch die lehrerin nicht wirkt wie sie es sich erhofft, da sie schlehct formuliert.",1
"Dass die schlechten Leistungen Michaels nicht von seiner Unbegabtheit abhängen sieht man daran, dass die Lehrerin ihn nicht als einen schlechten oder unbegabten Schüler ansieht sondern einen Schüler, dessen Faulheit ""himmelschreiend"" ist.",1
"Auch Fremdattribution spielt eine große Rolle. Die Eltern attribuieren den Misserfolg ihres Sohnes auf internal stabile Eigenschaften, was dazu führt, dass der Sohn dies ebenfalls tut. Die Lehrerin hingegen attribuiert sie auf internal variable Zustände, nämlich fehlende Anstrengung. Die internal stabile Fremdattribution der Eltern führt dazu, dass der Sohn keine wirkliche Motivation zeigt, seine Leistung zu verbessern. Die internal variable Attribution der Lehrerin hingegen könnte dem Schüler als Anreiz dienen.",1
Relativierungen des Arguments:,0
"Also zur Zusammenfassung der Punkte auf die wir uns geeinigt haben. Die Eltern haben Michael in seiner Meinung, dass er unbegabt ist bestärkt und das führt zu einer Schwächung der Motivation. Frau Weber hat ihn, wenn auch nicht perfekt, darauf hingewiesen, dass er sich mehr anstrengen muss, wenn er nächstes Jahr bestehen will. Dies kann zu einer Steigerung der Motivation führen und zu einem wegleiten der von Michael verwendeten Begründung, dass er unbegabt sei.",1
 Selbstattributation.,0
variabel,1
"Dadurch das die Lehrerin selber an ""Faulheit"" glaubt, also eine Lokalität die zwar innerhalb der Person ist, ",1
sondern faulheit liegt.,1
"Dem stimme ich zu, sie motivieren ihn nicht",0
bestärken lassen,1
"Information aus dem Fall, die wir noch nicht betrachtet haben, ist zudem, dass die Lehrerin internal variabel die Faulheit in den Vordergrund stellt, statt die Variable Anstrengung, d. h. die Lehrerin müsste reattribuiert werden in der Auffassung",1
 zielt auf den internal,1
"ja wobei er das ja schon auch tut in dem er sagt, dass Mathe nicht SEIN Fach ist.",0
 Wie schließen wir denn ab?,0
"Genau, die Anstrengung wäre ja einmal internal variabel und die Begabung internal stabil",1
"egal wie sie es meint. Der Begriff himmelschreiende Faulheit wirkt denke ich nicht auf den Schüler, als sei das was internal variables",1
"Unterstützt die Lehrerin den Schüler jedoch, könnte er Freude am Matheunterricht bekommen - die bester Voraussetzung sich mehr anzustrengen",0
 Fremdattributionen lernt er keine mathematischen Formeln auswendig.,1
variabel. ,1
Fremdattributionen können auf das Verhalten von Schülern Auswirkungen haben.,0
"Für euch zur Info: In den Reitern über dem Chat findet ihr den Fall, die Aufgabenbeschreibung und die Attributionstheorie. Falls ihr Fragen habt, könnt ihr sie jederzeit stellen.",0
"-Ein Schüler, der schlecht in Mathe ist, ist bei einem schulpsychologischen Beratungsgespräch",0
"Er orientiert sich sozusagen an dem, was seine Eltern auch bereits gemacht haben",0
"Hallo, ich mir auch, Entschuldigung!",0
Perfekt!,0
"Weil sie versucht, seinen Misserfolg (internal) variabel durch Anstrengung zu begründen.",1
damit er von internal stabil zu internal variabel wechselt,1
"Ein wichtiges Konzept, was man dabei beachten sollte, ist das die Lehrerin ihn nicht unterstütz oder versucht zu motivieren sondern sofort annimmt da s er faul ist und dadurch jemand sofort demotivitiert",0
Internal stabile Attributonen sind nicht zu ändern.,0
Eltern und Lehrer sollten an die Kinder glauben und sie fördern. ,1
"Eine neue Idee zu diesem Fall ist, dass die Mathe Lehrerin die auch keine Hoffnung in dem Sohn sieht ein Faktor spielt variabel-external negativ Fremdattributiert da sie ihm die Faulheit des Vaters zuspricht anstatt ihn zu motivieren",1
"Du hast gerade geschrieben, dass ein Reattributionstraining weiterhelfen könnte, ein interessanter Ansatz.",0
"Auch Fremdattribution spielt eine große Rolle. Die Eltern attribuieren den Misserfolg ihres Sohnes auf internal stabile Eigenschaften, was dazu führt, dass der Sohn dies ebenfalls tut. Die Lehrerin hingegen attribuiert sie auf internal variable Zustände, nämlich fehlende Anstrengung. Die internal stabile Fremdattribution der Eltern führt dazu, dass der Sohn keine wirkliche Motivation zeigt, seine Leistung zu verbessern. Die internal variable Attribution der Lehrerin hingegen könnte dem Schüler als Anreiz dienen.",1
sie bestärkt ihn somit einfach mehr zu lernen und dass es in seiner hand liegt,1
"Ein wichtiges Konzept, was man dabei beachten sollte, ist, dass die Lehrerin probiert, den Misserfolg auf einen variablen, internalen Faktor zu lenken.",1
"Du hast gerade geschrieben, dass Frau Weber es internal variabel sieht und dem stimme ich auch ein wenig zu, da er sich auch ein bisschen mehrt anstrengen kann bzw sich Hilfe in Form von Nachhilfe suchen kann. Wie siehst du das?",1
"Interessant is auch, wie du schon gesagt hast, wie Fremdattribution in diesem Fall von statten geht. Die Eltern attribuieren seine Probleme durch internal-stabile Faktoren, wie der Begabung. Ich würde eventuell sogar soweit gehen zu sagen, seine Eltern sehen dies als genetische Veranlagung. Die Lehrerin allerdings versucht, Michael dahin zu bewegen, dass er seine schlechte Leistung in Mathematik internal-variabel seiner Anstrengung zuschreibt. Laut 52 ist es ja günstig, Misserfolge auf variable Ursachen wie Anstrengung zurückzuführen.",1
Michael wurde von Anfang an durch Fremattribution der Eltern,0
würde ich auch zustimmen,0
"Die Hauptperson sieht ihre Fähigkeiten und Begabungen im Fach Mathe als unzureichend und bringt diese Erklärung mit dem seiner Eltern in Verbindung, welche ebenfalls das Fach Mathe wenig erfolgreich bestritten.",0
"Ich würde sagen, es handelt sich also um zwei konkurierende fremdattributionen. es kommt darauf an, welche ihn eher beeinflusst. in dem alter gibt man ja sowieso nicht viel auf das was einem autoritäre personen sagen. aber da die eltern ihm ja quasi zustimmen unter dem motto ""ist schon nicht schlimm, du kannst es halt nicht besser"", sehe ich keine guten chancen für ihn, sich tatsächlich zu verbessern",1
"Danke für die Erklärung! Ihr könnt den Chat jetzt über den ""Chat Beenden""-Button schließen.",0
"Du hast gerade etwas gesagt, dem ich  zustimme, und zwar, dass er eine internal stabile Attribution hat. Seine Mathelehrerin geht davon aus, dass er zu faul ist, das wäre ja dann internal variabel. Ich glaube aber, dass er auf die Meinung der Lehrerin nicht so viel wert legt/ihr nicht zustimmt und deshalb auch keine Möglichkeit sieht, an dem Problem etwas zu ändern.",1
ich fange jetzt einfach mal mit der analyse an:,0
 variable atribution),1
Ein mehrmaliges Versagen kann zum Aufgeben verleiten aber viele Schüler lassen sich nicht so schnell unterkriegen und machen trotzdem weiter,0
"alles klar, danke",0
"Ich denke zu der ""Schwierigkeit"" gehört auch sein fehlendes Selbstbewusstsein (v.a. im Fach Mathe).",0
 variable attributation!),1
1.Hypothese zum Fall:,0
"stabile Attribution zu,",0
"a) in der neunten klasse:war positiv attributiert von seiner lehrerin,",1
 für die Ursache der Mißerfolge allerdings nicht die Begabung sondern die Anstrengung.,1
"und die lehrkraft sagt ja es wäre Faulheit, was ja variabel ist, das heißt es könnte geändert werden. würde er sich darauf konzentrieren, könnte er zu der Einsicht kommen, dass sein Misserfolg in Mathe nicht stabil ist, und er es ändern könnte",1
"Du hast gerade etwas gesagt, dem ich  teilweise zustimme. Die Lehrerin hat einerseits eine positive Wirkung auf den S, da sie variable internale Attribution an den Schüler bringt. Anderseits sagt sie auch, dass sie die ausrede nicht schlecht finde, was kontraproduktiv ist, da diese Ausrede eben auf die Begabung zurückzuführen ist.",1
"Auch Fremdattribution spielt eine große Rolle. Die Eltern attribuieren den Misserfolg ihres Sohnes auf internal stabile Eigenschaften, was dazu führt, dass der Sohn dies ebenfalls tut. Die Lehrerin hingegen attribuiert sie auf internal variable Zustände, nämlich fehlende Anstrengung. Die internal stabile Fremdattribution der Eltern führt dazu, dass der Sohn keine wirkliche Motivation zeigt, seine Leistung zu verbessern. Die internal variable Attribution der Lehrerin hingegen könnte dem Schüler als Anreiz dienen.",1
"Hallo, willkommen in der Chatumgebung. Es hat doch noch geklappt! :)",0
Sie begründet seine Noten durch Faulheit,1
"Auch Fremdattribution spielt eine große Rolle. Die Eltern attribuieren den Misserfolg ihres Sohnes auf internal stabile Eigenschaften, was dazu führt, dass der Sohn dies ebenfalls tut. Die Lehrerin hingegen attribuiert sie auf internal variable Zustände, nämlich fehlende Anstrengung. Die internal stabile Fremdattribution der Eltern führt dazu, dass der Sohn keine wirkliche Motivation zeigt, seine Leistung zu verbessern. Die internal variable Attribution der Lehrerin hingegen könnte dem Schüler als Anreiz dienen.",1
Vielleicht hat er aber Lernprobleme oder sowas.,0
"Seine Lehrerin dagegen glaubt, dass es sich um Faulheit handelt, attribuiert seine Leistung als internal-",1
1. internal-,0
"wenn michael diese sichtweise übernimmt wäre esfür ihn wesentlich vorteilhafter,da jeder eineneinfluss auf seine eigene anstrengung hat ",1
"die lehrerin reagiert da schon ganz richtig, daß sie versucht ihm klar zu machen, daß das von seiner Anstrengung abhängt",0
mit welchem fall wollen wir denn anfangen? so das wir uns systhematisch durchackern,0
variable atribution.,1
Anstrengungen sind laut Klassifikationsschema variabel und somit änderbar.,1
"da die Eltern den Sohn bekräftigen, indem sie ihm bestätigen, dass er unbegabt ist. ",0
" stabile"" Klassifikation",0
ja,0
variabel,1
 variable attribution)zurück.,1
" günstig zu beeinflussen,",1
"Die Schwierigkeiten, die Michael hat sind seine Attributionsmuster, da er denkt, dass es an seiner fehlenden Begabung liegt. Er kann die schwierigkeiten bewältigen, wenn er internal unstabil attribuiert, was aber vermultiich mit der Beziehung seiner Lehrerin zusammenhängt (Hattie, keine Ahnung welches Jahr). Michale attribuiert internal stabil auf seine Fähigkeiten, genauso wie seine Eltern. Seine Lehrerin scheint eher auf unstabile internale Sachen zu attribuieren, was bedeutet, dass Michael durch mehr Anstrengung auch bestehen könnte.",1
"Du hast gerade geschrieben, dass seine Noten vererbt sein könnten, denkst du dass das möglich ist?",0
"Die Lehrerin dagegen richtig,",1
Seid ihr beide da?,0
"Du hast gerade geschrieben, dass er in Mathe mehrere Fremdzuschreibungen bekommt und seitens der Lehrerin insofern, dass sie sagt er würde sich nicht genug anstrengen. Diese Zuschreibung könnte man aber beeinflussen und demenstprechend ändern. Während der Vater einfac davon ausgeht, dass er schlecht sei und dennoch eine Unfähigkeit zugeschrieben. Diese Zuschreibung weiterhin, (kann) beeinflusst Michael negativ.",1
Relativierungen des Arguments:,0
"das michael nicht besser wird, bzw nicht wirklich lust zum lernen hat liegt auch daran dass die eltern ihm immer wieder einreden dass das ja nicht so schlimm ist, sie selbst seien ja auch keine leuchten gewesen. ",0
sie erzeugt damit eine internal ,1
"Information aus dem Fall, die wir noch nicht betrachtet haben, ist das Micheal trotz Mathematik sehr motiviert ist auf die 9.Klasse. Das könnte  bedeuten das durch die variable internale Fremdattribution er motiviert wurde",1
"Ja, aber eine positive, die Motivationssteigern wirken soll. Die Fremdattribution der Eltern ist nach der Attributionstheorie ungünstig, da sie den Misserfolg auf internale, stabile Faktoren (Begabung) lenkt",1
"Du hast gerade etwas gesagt, dem ich zustimme, und zwar ist das demnach eine internale und stabile Attribution",0
stabile gründe zurück,0
finde ich gut!wer macht was? ich würde gerne den fall mathe machen!ciao,0
Belege und Begründungen:,0
variable Attribution zurückführt .,1
internal,1
 4.)fr.weber=lehrerin:,1
"aber ich finde es besonders wichtig, dass die Eltern dem Kind die schlechten Mathenoten nicht auxch noch mit der Begründung abnehmen, dass sie ja alle schlecht in Mathe sind. ",0
Auch die falsche Wortwahl der Lehererin könnte eine schlechtere Motivation beim Peters auslösen.,0
" Die Lehrerin hat insofern Recht, dass sie seine Geschichte als Ausrede abtut, ob es auf diese Art natürlich pädagogisch richtig ist, dass ist eine andere Frage",1
Mathe ist einfach eine wichtige Basis fürs Beruf und eifach fürs Leben allgemein.,0
"Du hast gesagt, dass du mir zustimmst, dass es Teil seines festen Charakters sei - damit meinte ich die Faulheit, die die Lehrerin anspricht. Und ich finde, dass sie ihm quasi einredet faul zu sein. Sie meint es vermutlich gut, weil es im Grunde dann ja eine internale unstabile Attribution ist, die man ändern kann. Aber wenn mir jemand die ganze Zeit sagen würde, dass ich Faul bin, dann werde ich das vielleicht auch. Ich meine einfach, dass sie es anders formulieren könnte, wie beispielsweise ""Ich weiß, dass du es schaffen kannst, wenn du dich mehr anstrenst."" anstatt zu sagen, ""Wenn du nicht so faul wärst, wärst du gut genug."" (So kommen ihre Worte zumindest bei mir an)",1
"Sie macht ihm nur Angst mit dieser Aussage,da sie davon aussgeht er sei faul.",0
Die Eltern haben höchstwahrscheinlich nicht das richtige gemacht.,0
intern,0
die reaktion der eltern ist wirklich nicht gerade die beste. ,0
Ja wobei seine eigene Attributionen nicht ganz klar sind finde ich.,0
Ja das stimmt. Ich denke es wird schwierig ihn wirklich internistisch motiviert zu bekommen.,0
Zeile 52,0
Ok,0
"zeigt sie, das sie nicht denkt, das Michael dumm ist, sondern wenn er lernen würde, könnte er Mathe gut schaffen.",1
 internal,0
*das zweite Korrekt weg,0
"eine variable ursache dauert nicht,",0
"und die lehrkraft sagt ja es wäre Faulheit, was ja variabel ist, das heißt es könnte geändert werden. würde er sich darauf konzentrieren, könnte er zu der Einsicht kommen, dass sein Misserfolg in Mathe nicht stabil ist, und er es ändern könnte",1
alle familienmitglieder waren schlecht in mathe,0
 Variabel).,1
Fremdattributation der Lehrerin ,1
"aber auch seine lehrerin sagt ihm, dass er sich anstrengen müsste um weiterzukommen!",1
"Eine einfache Fremdmotivation seiner Lehrerin, hat ihm gezeigt, dass es nicht nur auf die Begabung, ",1
"Michaels Problem ist, dass er seine schlechte Mathe-Leistung internal-stabil attribuiert und auf mangelnde Begabung zurückführt. dies ist beeinflusst durch die internal-stabile Attribution seiner Eltern , die meinen, dass die gesamte Famiie vn Natur aus schlecht in Mathe sei. Zudem hat seine Lehrerin eine internal-variable Attribution und hält Michael für faul, was ebenfalls zu seiner schlechten Motivation beiträgt, da es besser wäre ihm eine external-Variable Ursache für seinen Misserfolg zu vermitteln.",1
ja also insgesamt ungünstige Fremdattributionen,1
Aber Michale wird keine Chance geboten auf eine Günstige Selbs,0
 sich von seinen Eltern nicht beeinflußen lassen.,0
"wobei Michael, der dabei durch siene Eltern unterstützt wird ( Fremdattributation ) ",0
Die negative Fremdattribution der Mathelehrerin,1
1.Hypothese zum Fall:,0
variable atribution),1
 Sie sollten auf ihn einwirken und zwar unterstützend. Sie sollten ihn motivieren und dazu ermutigen sich mehr an zu strengen.,0
internal,1
aus Sicht des Vaters:-keine Mathematikbegabung in der Familie,0
sie erzeugt damit eine internal ,1
variablen Attribution entspräche.,1
"Er sollte eher durch seine Lehrerin angespornt werden, ",1
"in seinem falschen Glauben, er hätte es geerbt zu verstärken.",0
"ja aber sie sagt wenigstens dass es um die Anstrengung geht - also eine variable internale Attribution, die Michael ändern könnte",1
 variable attribution- und er solle sich einfachmehr anstrengen.,1
